,Stim
2531,نہ تم الحاد کے حامی ہو نہ ایمان کے دوست
2532,اطاعت رسول کی اہمیت صدیق اکبر کی نظر میں
2533,صوبہ خیبر پختونخوا میں ضلع نوشہرہ کا محل وقوع
2534,تمام تہواروں کی تقریبات چاردیواری کے اندر کی جاتی ہیں۔
2535,اور جب داخل ہو گئے تو خبر لگا دی ۔
2536,پوتا: قاسم بن حسن میدان کربلا میں شہید ہوئے
2537,یہ وہ سحر تو نہیں جس کی آرزو لے کر
2538,اس طرح مٹی کی کھلونا گاڑیاں بھی ملی ہیں۔
2539,لوگ کہتے ہیں بہت غم خوار رہتے تھے یہاں
2540,اور آپ کو دفن کے لیے کربلا لے گئے تھے۔
2541,یہ مغربی چینکیہوا بازی میں کلیدی حیثیت رکھتا ہے۔
2542,اور مختلف بھی ایک خط وقت پر واقع ہوتے ہیں۔
2543,ابھی تو نئے نام سے استقبال کا دھاگہ کھولیں گے
2544,ان گلی کوچوں کی بس سیر کرا دے مجہ کو
2545,رضوان بھائی تو اسے اتارتے اتارتے بوڑھے ہو جائیں گے
2546,جب تک یہ کھائیں میں باقی چیزیں لے آتا ہوں
2547,جاتے ہیں لاکھوں ہی وہ ہم کو سنا کر باتیں
2548,فلورس انڈونیشیا کے جنوب میں جزائر سنڈا اصغر کا ایک جزیرہ ہے
2549,مگر جو بھی یہاں لکھا ہے اس میں نغمگی سی ہے
2550,اور انگریزی بھی کوئی ڈھنگ سے پڑھائی جائے تو فائدہ ہو
2551,جہان کی اب و ہوا امام علیہالسلام کو موافق تھی۔
2552,اس طرح یہ موٹر کپیسٹر کی طرح کام کرتی ہے۔
2553,خالہ جی کا گھر یہ محاورہ اب سمجھ میں آیا
2554,شکستہ دل لئے بے کل پئے اظہار میں بھی ہوں
2555,اس گھر میں مرے نام کا رکھا بھی نہیں کچھ
2556,مجھ کو چھپتا دیکھ کے تو بھی حیرت ہے ہنس لیتی ہے
2557,شق ہوگئے ہونگے سمندر کے سینے بھی ان کے نوحے سنکر ۔
2558,ولی کی شاعری مےں سراپا نگاری بدرجہ اتم موجود ہے۔
2559,اسکین صفحہ نمبر - 4 : ٹائپنگ مکمل از شکاری
2560,سنا ہے شادی وادی کر دیتے ہیں بڑوں کی
2561,مجھے انقلاب زمانہ کا یقین آئے تو کس طرح
2562,لیکن المیہ یہ ہے کہ شاعر بھی تو نہیں ہوں ڈھنگ سے
2563,بلکہ اپنے دفتر کو میں نے ہی ٹیگ کر رکھا ہے
2564,فلک شیر بھائی آپ کو بھی یونہی لگ رہا ہے کیا
2565,وہی عراق میں آپ کی پہلی شادی ہوئی تھی۔
2566,تعاون خصوصی : اظہار ریسرچ انسٹیٹیوٹ آف پاکستان لاہور
2567,مچھ جیل کو توڑ شین نورزئی ایک اشتھاری مجرم قرار
2568,جامعہ پنجاب کے لیے متعدد تحقیقی مقالات تحریر کیے۔
2569,ہمارے جوانوں نے امریکی وفاداری کا حق ادا کردیا ہے ۔
2570,ایڈنبرا اگرچہ ہے لیکن سب سے بڑا شہر گلاسگو ہے۔
2571,فلم 2012 نے ابھی تک 225 ملین ڈالرز کما لئے
2572,کہ کل اور آئیں گے مجھ سے بہتر کہنے والے
2573,ہم نے تو دردناک واقعہ بلکہ مرثیہ لکھا ہے بھائی
2574,اگر آپ کو یہاں کوئی حل نہ ملا تو آپ
2575,تعلیم کے ساتھ ساتھ اچھی تربیت بھی بہت ضروری ہوتی ہے
2576,اور وجہ وہی ہے جو حس صاحب کے گوش گزار کی
2577,2 ۔ نوکری کے لیے رشوت اور سفارش کی اہمیت
2578,یہ کتاب ابو نصر محمد بن عتبی کی تصنیف ہے۔
2579,ولی اسے مختلف ناموں سے یاد کرتے ہیں۔
2580,نجف اشرف میں آپ کے مشہور اساتذہ یہہیں:
2581,کیا بات ہے بہت شکریہ اتنی عمدہ شیئرنگ کے لیے
2582,اور آپ پیر شہابالدین شاہ سے تین سال چھوٹے تھے۔
2583,آپ کی وفات قصبہ جرول بہرائچ ھ میں ہوئی۔
2584,ارے یہ تو میرے والے صفات آپ کے پاس پہنچ گئے
2585,مگر بیہودہ رسموں کیلئے وہ وقف ہیں یک سر
2586,سنتے تھے اب تو ملک میں انصاف ملے گا
2587,اسی لیے تو سعود بھائی سے پوچھ رہی تھی آنی
2588,اخبار مقامی اور عالمی تبصروں کے لیے مشہور تھا۔
2589,میں بھی چاکلیٹ کھا لیا کروں گی ہی ہی ہی
2590,جب کہ یہ اوصاف یہ اخلاق ہیں پھر کیوں نہ ہو
2591,یہودیت میں آخری نبی ملاکی کو تسلیم کیا جاتا ہے۔
2592,سر دلبراں از حضرت شاہ سید محمد ذوقی ذوقیہ کراچی
2593,ہر شے کی ماہیت پہ جو کرتا ہے تو سوال
2594,اور اپنے کرم سے جنت الفردوس میں عالی مقام بخشے
2595,اور میری طرف سے فی الحال سب سے لیٹ خوش آمدید
2596,شین کو 2003 میں ایک غیر متعلقہ کیس میں گرفتار کیا
2597,نسخے لکھ جاتے ہیں خاطر سے اطبا جھوٹ سچ
2598,گنتی میں اسے چار سو چوراسی بولا جاتا ہے۔
2599,خالد محمود چوہدری ، بدھ بوقت 3 : 45 شام
2600,ایلچی نے کہا کہ آپ میرے ساتھ ابرھہ کے پاس چلیں۔
2601,خدا کرے کہ میرے اک بھی ہم وطن کے لئے
2602,یہ زبان اکثر سر پر سے ہی گزر جاتی ہے
2603,میں نہ حوا ہوں نہ مریم ہوں نہ میں آسیہ ہوں
2604,مارکیز کا ناول پہلوں دس دتی گئی موت دا روزنامچہ
2605,اب کوشش کروں گا کسی اور کے متعلق لکھنے کی
2606,ایمآر کیانی - سابقہ منصب اعلی لاہور عدالت عالیہ
2607,مرے مقدر جو ایک مدت سے سو رہے ہیں
2608,جناب شاکر القادری صاحب کی خوبصورت غزل کی پیروڈی
2609,اسد شفیق کا ایک اچھا شاٹ چار اسکور کے لیے
2610,بہرام سقا بردوانی بنگال کے مشہور صوفیا میں سے ایک ہیں۔
2611,ہاں جی کھانے والی بات سمجھ آ گئی ہے
2612,وہ باتیں ایسی باتیں ہیں کہ بس باتیں ہی باتیں ہیں
2613,ایک مختصر مگر خوبصورت انگریزی نظم مع ترجمہ
2614,3 خیرپور ریڈیو اسٹیشن کی نشریات کا آغاز ہوا۔
2615,مگر اس کی یہ آرزو پوری نہ ہو سکی۔
2616,ملتا ہے پیار کے بدلے پیار ہو قسمت والوں کو
2617,گنتی میں اسے ایک سو سات بولا جاتا ہے۔
2618,عمومی طور پر یہ سرخ رنگ کا ہوتا ہے۔
2619,1841ء - جان ٹائلر امریکا کے دسویں صدر بن گئے۔
2620,اس کے بعد پیراگراف 29 میں فاضل جج فرماتے ہیں
2621,یہی نظریہ بعد میں پاکستان کے قیام کی بنیاد بنا۔
2622,ہاتھ سے کس نے ساغر پٹکا موسم کی بے کیفی پر
2623,زینب تو کھانے پکانے میں بھی سیاست شروع کر دیتی ہے
2624,""""""" یعنی وہ تمہارے حالات کو دیکھ رہا ہے """""""
2625,خواب ہی خواب تھا تصویریں ہی تصویریں تھی
2626,کلی میں ارل سٹین نے جو کھدائی کروائی تھی۔
2627,آپ کہانی نے میری تحریر کو زندگی بخش دی ہے
2628,تاریخ محمد کتب خانہ قصہ خوانی بازار پشاور
2629,بڑا آدمی نہ پریشان ہوتا ہے نہ خوفزدہ۔
2630,ابن عربی کی اسی تفسیر سے ایک اور حوالہ دیکھئے
2631,ماشااللہ خدا آپ کو دن دگنی ترقی عطا فرمائے
2632,دوسرے کہ یہ کیسی وفا ہے جو اس مصرعے کی تعبیر ہے
2633,ارجنٹائن کے علاقائی سمندر میں بحری حیات بکثرت ہے۔
2634,اخیر عمر میں ناک میں ایک زخم ہو گیا۔
2635,بھیا آج آپ نجم شیراز کے پیچھے کیوں پڑ گئے ہیں
2636,ناراض تو میں ہوں پر میرا ایک مسئلہ حل کریں
2637,سر میں تھا وہ قدرت کا فسوں ساز سے پہلے
2638,اللہ آپ کو بھی تندرستی عطا فرمائے اور برکتوں سے نوازے
2639,آسمانی آفتوں کے آگے انسان کا کچھ بس نہیں چلتا
2640,ٹیگ : اردو لائبریری ، اپڈیٹ ، جیہ ، پروف ریڈنگ
2641,رفاعی سلاسل تصوف میں سے ایک سلسلے کا نام ہے۔
2642,انکے ہاں حریف بھی قوم کے لئیے شریف ہوتا ہے
2643,اس کی وجہ سے ان کی 7 بیٹیاں اور دو بیٹے ہیں۔
2644,چپکے سے کہہ رہے ہیں ' میں صدقے حضور آئے '
2645,مگر تجریدی ہیں اور چند بیساختہ لکیروں پر مشتمل ہیں۔
2646,نورانی قاعدہ، طبع مکتبہ اشرفیہ ہردوئی، یوپی، ہند
2647,اور ہاں بھئی میری ٹیم کے لیے لڑی تم مبارکباد کی
2648,مگر ہجوم کے سامنے میری کچھ پیش نہ گئی۔
2649,پھر امی کو فون کر کے بہت ساری باتیں کرنا
2650,چھٹی صدی قبل مسیح کے چاند گرہنوں کی فہرست
2651,اب میں شاید ہی کوئی برہما کی پوجا کرتا ہو۔
2652,اگر بھی نہ کام آئے تو قسمت کی خرابی ہے
2653,کئی انواع نیم استوائی شمال میں بھی ملتی ہیں۔
2654,اقوام متحدہ کا دفتر برائے منشیات و جرائم۔
2655,ارے واہ اتنی جلد جوابات دے بھی دیے
2656,عمر جب بیت چلی تو یہ کھلا راز نصیر
2657,ثابت نہ تھا کہ روح کہاں تھی کہاں گئی
2658,ثمینہ بہن کو تہہ دل سے محفل پر خوش آمدید
2659,10 ۔ عالی شان جنت میں قیام پذیر ہوں گے
2660,آزادی حاصل کرنے کے دنوں میں ہندوستان تقسیم ہو گیا۔
2661,وہ سی شی کو نہنی کے نام سے پکارا کرتے تھے۔
2662,اور ہندو سماج میں اچھوت کی آزادی کے لئے جدوجہد کی
2663,اسلام سے پہلے بھی عربوں میں جنوں کے تذکرے موجود تھے۔
2664,تائیوان : ہسپتال میں آگ لگنے سے بارہ ہلاک
2665,عطار کے اقوال سوانح حیات گنجور فارسی کتب خانہ پر
2666,تم ہم سے پیار کرنے کی ذرا سی بھول کرلو
2667,خیال آتا ہے آدھی رات کو جب بھی تیرا دل میں
2668,گوجرانوالہ ریلوے اسٹیشن پاکستان کے شہر گوجرانوالہ میں واقع ہے۔
2669,نرس : تم روزانہ صرف ایک روٹی کھایا کرو
2670,سورج کے ساتھ طلوع اور غروب ہونے والے 'بچے'
2671,سمہ سٹہ جنکشن ریلوے اسٹیشن سمہ سٹہ جنکشن میں واقع ہے
2672,اور یوں پاپائیت کا ایک دور یورپ کے اندر چلا۔
2673,جب اپنا قافلہ عدم و یقیں سے نکلے گا
2674,دماغ کی دہی تو نہیں بنی بڑا مزہ آیا
2675,1900ء میں ایرئیل کا خاندان روس سے یورپ منتقل ہوا۔
2676,گزرے برے حالات کبھی کبھی یاد آتے ہے
2677,سوان 200 وکٹیں حاصل کرنے والے پہلے انگلش آف اسپنر
2678,وہ دین اسلام کے طور پر اسلام کی پیروی کرتا ہے۔
2679,ان کو فنکار کی کمزوریوں سے کوئی واسطہ نہیں تھا۔
2680,آنے والے دور کے انسان ہم سے جینا سیکھیں گے ۔
2681,شبلی نعمانی نے میں اس کتاب کی بہت تعریف کی ہے۔
2682,ملا ہے جب سے خط پیارے کے چھٹی آرہے ہو تم
2683,سلسلہ نسب امام جعفر الصادق تک جا ملتا ہے۔
2684,آنکھ کی کھڑکی کھلی ہے عکس باہر آئے گا
2685,بارش کی مقدار ہر علاقے میں مختلف ہوتی ہے۔
2686,عرب میں یہ لوگ نکاح کر کے بچیوں کو مارتے ہیں
2687,اس کے دنیا ال رسول کی نسل سے چھلک رہی ہے۔
2688,وہ ہمیشہ حال اور مستقبل کی سوچنا چاہتے ہیں۔
2689,گھسر پھسر تو نہیں کوئی مشورے کی بات کر رہے تھے
2690,رہنے دیں جناب ایسا تو ہوتا رہتا ہے یہاں
2691,ایک ملال کی گرد سمیٹے میں نے خود کو پار کیا
2692,علاقے پر ترکوں کا اثر و رسوخ قائم ہو گیا۔
2693,گنتی میں اسے سات سو پینسٹھ بولا جاتا ہے۔
2694,گنتی میں اسے سات سو تینتالیس بولا جاتا ہے۔
2695,گنتی میں اسے سات سو چھیانوے بولا جاتا ہے۔
2696,پیکوکان کو اڑانے کے لیے مشاق ہونے کی ضرورت پڑتی ہے۔
2697,ہرالڈ ہیمر اسٹورم؛ رابرٹ فورکل؛ مارٹن ہاسپلمتھ، ویکی نویس
2698,حالانکہ پاکستان میں وائرس سے مرغیاں متاثر ہوئی ہیں۔
2699,"""وہی جو عمر بھائی نے کہا """" زبان """""""
2700,دل بے قرار نے اور میاں وہیں چٹکی کے کے جگا دیا
2701,چلو جی ایک اور منزل پا لی آپ نے
2702,اللہ ہمارا منصف ہمارے دل میں صبر پائے گا
2703,ٹیگ : شان الحق حقی ، غزل ، ناہید اختر
2704,بس چل دی بیچ لاہور اس کا نہیں کوئی جوڑ
2705,جس کا مطلب ہے کہ یہ شہر چلایا گیا ہے۔
2706,یہ نیشنل ہائی وے اتھارٹی کے زیر انتظام ہے۔
2707,شروع میں تو یہ خبر انتہائی دل گرفتہ تھی۔
2708,ہیں زخم زخم اگر دل ہے اگر فگار عشق
2709,اسے منطقی پروگرامنگ سکھانے کے لیے بھی استعمال کیا جاتا ہے۔
2710,مجھے ڈرایا ناں تو میں نے بھی ڈرا دینا ہے بھیا
2711,مشرق میں اس کی سرحدیں ضلع ٹھٹہ سے ملتی ہیں۔
2712,نیرنگ خیال یہ ایکس سے کیا بنتا ہے جگر گوشے :
2713,مت پوچھ کتنے ضبط کے موسم بسر کئے
2714,دو لقمے اپنی طرف سے لیں پھر ایک ہماری طرف سے
2715,انیسویں صدی میں 321 سے زیادہ بڑی جنگیں لڑی گئیں۔
2716,ویسے آپ پریشان نہ ہوں میں ابھی یہی ہوں
2717,وینیزویلا کے اپوزیشن لیڈروں میں سالہا سال مایوسی میں ہے۔
2718,گنتی میں اسے نو سو انہتر بولا جاتا ہے۔
2719,رخصت کے وقت وہ بھی آنسو نہ روک پائے
2720,کوئی کمرہ ہے جس کے طاق میں اک شمع جلتی ہے
2721,اب تو ایک سال کی وارنٹی بھی ملتی ہے ان کے ساتھ
2722,کیا ایسا نہیں ہو سکتا کہ اس کا ایڈریس صرف یہ ہو
2723,اور کوڑے کرکٹ کا تبادلہ کوڑے کرکٹ سے ہوا تھا -
2724,گلوں سے خار بہتر ہیں جو دامن تھام لیتے ہیں
2725,جارجیائی بنیادی طور پر روس کی جمہریہ جارجیا میں آباد ہیں۔
2726,بارہ سال کی عمر میں پہلی نظم لکھی۔
2727,اب تک کا سب سے بڑا لسانی گروہ ہن ہے۔
2728,کیسے سکھائیں گے عارف صاحب ان کو خود نہیں پتہ
2729,گھر پر مارٹن بوبر یدش اور جرمن زبانیں بولتے تھے۔
2730,نا صرف دیکھیں اپنے آپ بھی اس پر کچھ کاریگری دکھائیں
2731,سلسلہ پاکستانی ایکٹر سلطان راہی فلم ڈاٹیلز ماپوپ اورج
2732,ڈاکٹر - نوبل انعام یافتہ نظریاتی طبیعیات؛ فلکی طبیعیات
2733,مویشیوں کی ان مورتیوں کی لمبائی تین سے چار انچ ہے۔
2734,توہین عدالت کا بھی کسی نے ذکر تک نہ کیا ۔
2735,شرط اتنی ہے کہ دل اسکا مجھے خام ملے
2736,کچھ عرصہ اسمبلی میں حزب اختلاف کی قیادت کی۔
2737,اس کی موت کو بلیو وہیل سے منسلک کیا گیا ہے۔
2738,14 اکتوبر: ریاست قلات پاکستان میں شامل ہو گئی۔
2739,آپ کے جسم خاکی کو کربلا میں دفن کیا گیا۔
2740,سلو اوور ریٹ : مصباح ایک میچ کے لیے معطل
2741,ان کو امام نے پیر کا لقب عنایت کیا تھا۔
2742,اس کے بعد وادی سندھ کی تہذیب ہر طرف ہے۔
2743,اب جھوٹ اور سچ کے دوراہے پر یوں کھڑے ہوئے
2744,ماہی احمد ، گذشتہ روز بوقت 3 : 39 شام
2745,ماہی احمد ، گذشتہ روز بوقت 3 : 32 شام
2746,ماہی احمد ، گذشتہ روز بوقت 3 : 40 شام
2747,کس کا خنجر ہے جو کر دیتا ہے سینے کو دو نیم
2748,زندگی کا بڑا حصہ تنگی و ترشی میں گزرا۔
2749,ابھی تو عمر قید کی سزا بولی بھی نہیں گئی
2750,طویل ہی ہو جاتا ہے وقفہ یہاں آ کر تو
2751,یہاں جو کچھ بچا سطح زمیں پر سب ترا لیکن
2752,اس کے معنی حیوان مثلا سانپ وغیرہ کے کاٹنے کے ہیں
2753,پھر کچھ اور بنا لیں ویسے آپکا طوطا کیا کھاتا ہے
2754,فصل سرما میں سحر کو غسل کر چکنے کے بعد
2755,حد ہو گئی وہ کیا جہاد پہ نکلے ھیں
2756,براہ راست 13 تبصرے اور بذریعہ فیس بک 5
2757,اندگی گزارنے کے لیے پتھر کے اوزار بناتا تھا۔
2758,اور آپنے اعلی کردار کی وجہ سے بہت مشہور ہوئیں۔
2759,چینی فلکیات میں دمدار سیاروں کو بہت اہمیت حاصل رہی ہے۔
2760,دم لبوں پر ہے مرا آ جو تجھے آنا ہے
2761,اوہو لگتا ہے کہ کوئی انفیکشن چل رہا ہے انکے گھر
2762,اسکا آسان سا حل ہے کے مائیکروسافٹ کی سائٹ سے کرلو
2763,[ ریکارڈز ] سب سے زیادہ اننگز کھیلنے والی اوپننگ جوڑیاں
2764,وہ علاقہ جو اب چین کا شمالی میدان کہلاتا ہے
2765,اللہ عزوجل آپ کو خیر کثیر عطا فرمائے مشاہد بھائی
2766,کانوں میں پہنے کے تکونے زیورات بھی ملے ہیں۔
2767,ذیل میں اسی سے متعلق مضامین دیے گئے ہیں۔
2768,11 قرآن کریم کے مجمل اور مبہم کو بیان کرنے والی احادیث
2769,یہ اسلامی ملک 1956 میں فرانس سے آزاد ہوا تھا ۔
2770,دیکھے وہ ایسے خواب اگر مجھ کو اس سے کیا
2771,عشق میں اچھے برے سب ہی کا احسان لیا
2772,ظاہر ہے اب ایک سے تو کام نہیں چل سکتا ناں
2773,نعمان بن مقرن معرکہ نہاوند میں امیر لشکر اور صحابی ہیں
2774,کجا گند شاپور خواندی ورا / جزین نام نامی نراندی ورا
2775,حدود اللہ کے خلاف کوئی معاہدہ اور اقرار جائز نہیں
2776,فہیم یار تم نے تو دعوت ہی قبول نہیں کی
2777,دل میں چاہت کے کئی تاج محل ٹوٹ گئے
2778,گنتی میں اسے آٹھ سو تریاسی بولا جاتا ہے۔
2779,گنتی میں اسے آٹھ سو سڑسٹھ بولا جاتا ہے۔
2780,8 نومبر پاکستان بمقابلہ جنوبی افریقہ چوتھا ایک روزہ ابوظہبی
2781,تاہم مختلف ممالک میں اس کی تعریف یکساں نہیں۔
2782,ابراہیم بن عبداللہ مسقطی : شہر حیدرآباد کی معروف شخصیت۔
2783,انھوں نے لاہور کے ایچی سن کالج سے تعلیم حاصل کی۔
2784,64 | تکبر میں ذلت ہے اور تواضع میں عزت | 102
2785,راولپنڈی جی ایچ کیو کے قریب شدید فائرنگ اور دھماکے
2786,بس ایک ایک دن گزرتے زندگی گزر جائے گی
2787,کل میں نے ماورا کو کہا تھا کے سارہ نظر نہیں آرہی
2788,کیا کیا نہ خواب ہجر کے موسم میں کھو گئے
2789,کالی سے حسب ذیل مراد ہو سکتے ہیں:
2790,اشرف اردو، فارسی اور انگریزی میں لکتھے ہیں۔
2791,زمین اور آسمان کے درمیان کالا سورج سفر میں تھا
2792,1940 کی دہائی میں شیعہ سنی کشیدگی برقرار رہی۔
2793,اور ساتھ میں تیمور بھی مجھ کو تنگ کر رہے تھے
2794,یہ فلم اسقاط حمل کے خلاف بنائی گئی تھی۔
2795,میں کچھ نہیں کہوں گا لیکن فیض آپ سے مخاطب ہیں
2796,پتھروں کی مغز اوزاروں کی دوسری قسم کچھوا نما ہیں۔
2797,یا جاندار اپنے والدین کی وراثیاتی معلومات پاتے ہیں۔
2798,پہلے ہی نیرنگ خیال باز نہیں آتا جٹا کہنے سے
2799,بکھر چکے ہیں بہت باغ و دشت و دریا میں
2800,مرا مطلب ہے پہلی کھیپ ہی میں چھانٹ دیتا ہے
2801,گولہ ماریں پھر ہم اپنا الگ فورم بناتے ھیں
2802,انہوں نے متعددا کتب تصنیف فقہ پر احسان کیا ہے۔
2803,اپنے بھائیوں میں سب سے آخر میں وفات پائی۔
2804,کر کے بحر و قافیہ تبدیل لکھ اور اک غزل
2805,دل کا دورہ پڑنے سے لاہور میں انتقال کیا۔
2806,تلخ اتنی ہو کہ مشکل مجھے پینا ہو جائے ۔
2807,میں گذشتہ ایک مہینے سے دنیاوی مصروفیت کے باوجود نماز پڑھنے
2808,محبوب بھائی ہم ئے بھی بتائیں یہ کیسے کیا جاتا ہے
2809,پھر کیا کرنا ہے ہم سے جو ہوگا ہم کرینگے جناب
2810,پھر دل سے دور کب ہو قرب و حضور تیرا
2811,ہولنکی کی پیدائش 1901ء میں سیچوان کے علاقہ چینگدو میںپیدا ہوئی۔
2812,1922ء میں حکومت کی طرف سے سر کا خطاب ملا۔
2813,جو ابھی لحد میں نہ اترے تھے مگر اتر گئے
2814,اہل سنت کے نزدیک یہ بڑے پائے کی تفسیر ہے
2815,جی بالکل ویسے بھی آپ سوچیں گے کس کے ساتھ
2816,انہوں نے حدیث کا بہت بڑا تحریری ذخیرہ چھوڑا
2817,وہ دن گئے جب خلیل خان فاختہ اڑایا کرتے تھے۔
2818,آبائی وطن موضع ناگڑیاں ضلع گجرات پنجاب، تھا۔
2819,عمر سیف ، گذشتہ روز بوقت 6 : 09 شام
2820,اس سلسلے میں ایک ڈاکٹر کا سرٹیفکیٹ بھی پیش کیا گیا۔
2821,ان کا تعلق ایک لوئر مڈل کلاس فیملی سے ہے۔
2822,رانی لکشمی نے اس وقت انگریزوں کا مقابلہ کیا۔
2823,عنایت خان نے بہترین انشاء پردازی وراثت میں پائی۔
2824,ان کا ناول لندن کی ایک رات بہت مشہور ہے۔
2825,پھر تجھ کو بتاتا ہوں میں کون ہوں کیا ہوں
2826,شیشوں کا مسیحا از فیض احمد فیض میری آواز میں سنیے
2827,جن کو اللہ و نبی حرمت و عزت دیں گے
2828,بی بی آپ غور سے دیکھیں یہاں گدھا دیکھایا گیا ہے
2829,یا پھرخلیفہ کا انتخاب کسی کی جانب سے نامزدگی پر ہو
2830,معذرت کے ساتھ مگر مجبورا ایسا لکھنا پر رھا ھے
2831,سر مہم آپ سے کیوں کر مرے سر کی ہوتی
2832,غبار آلودہ رنگ و نسب ہیں بال و پر ترے
2833,یہ میچ پاکستان بمقابلہ نیوزی لینڈ لاہور 1955 سے بہت ملتا ہے
2834,یہ دنیا کے چند بڑے پہاڑی سلسلوں میں شامل ہے۔
2835,میں اپنی خاک سے کٹ کر جیوں تو میرے خدا
2836,میں تو اس لیئے بولتی ہوں یہاں آکر کہ مجھے سیکھنی ہے
2837,واقعی شمشاد بھائی ایسے سخی تو ڈھونڈے سے نہیں ملتے
2838,اور آواز حلق میں پھنس جاتی ہے کہ اب کیا کہوں
2839,امام احمد رضا خان، احکام ترتیل، صفحہ 19
2840,حیف صد حیف کہ کچھ پست نظر پست اندیش
2841,ٹیگ : ماہ ربیع الاول ، میلاد النبی ، میلاد تصویر
2842,خودکش حملے ایک پاگل پن ہے : عمران خان
2843,ان کی آواز سرحد پار بھی سنی جانے لگی
2844,خوشی خوشی جو وقت گزر جائے وہی اچھا ہے
