,Stim
3445,آپ کا شمار علامہ محمد اقبال کے رفقا ءمیں ہوتا ہے۔
3446,وہ حسینی اور خواجہ بندہ نواز کی اولاد سے ہیں۔
3447,بس اس کی رضا اس نے چاہا اتنا ہی خدارا کافی ہے
3448,اور جو ختم ہو جائے وہ محبت ہوا ہی نہیں کرتی ہے
3449,جبکہ انکی ایک بڑی تعداد روس بھر میں بھی موجود ہے۔
3450,1844ء میں وہ قائم مقام گورنر جنرل ہند بھی رہا۔
3451,نہ کوئی بندہ رہا اور نہ ہی کوئی بندہ نواز
3452,""""""" کوہ """" کو ہندی میں کہتے ہیں پہاڑ"""
3453,1934ء میں صحافت سے اپنی عملی زندگی کا آغاز کیا۔
3454,کسی کی چپ کا بھی مطلب عجب عجب نکلا
3455,علم کے مطابق کسی واقعہ کا احتمال مختلف ہو سکتا ہے۔
3456,پکوڑا برصغیر پاک و ہند کے مشہور پکوانوں میں سے ایک ہے۔
3457,جبکہ باقی فونٹ میں ٹھیک آتے ہیں جیسے اردو نسخ ایشیا ٹائپ
3458,اس ویب سائٹ کی جانب سے اپریل دو ہزار دس میں
3459,بھائی ہمارے پاس کوئی بندوقیں تو ہیں نہیں کہ جا کہ لڑیں
3460,اللہ کرے پاکستانی ٹیم اسی طرح اچھا کھیل پیش کرتی رھے
3461,کبھی وہ موقعے سے نہ آسکے کبھی ہم نے موقع گنوا دیا
3462,امین اللہ اپ کی مبارک زبان کو اور بہی مبارک کرے
3463,نظام کے خاندان کی تذلیل کے لیے یہ نام چنا گیا تھا۔
3464,تقوی و طہارت میں اعلی مقام پر فائز تھے۔
3465,زرداری صاحب کی ذہنی صحت کے بارے میں شکوک و شبہات
3466,بالاکوٹ سے ناران کو جاتی سڑک اس کے کنارے سے گزرتی ہے۔
3467,جبی سیداں ضلع حویلی، تحصیل کہوٹہ کا ایک دور افتادہ ہے۔
3468,میں تو کسی گنتی میں ہی نہیں آتی آپ کے مقابلے میں
3469,پپو نام کا پپو ہے بڑا سیانا ہے جو راضی نہیں ہوا
3470,ویں صدی کی دوسرے پچاس سال میں یہ بنایا گیا تھا
3471,اس پر اس کی جے چند سے دشمنی ہو گئی تھی۔
3472,آٹا اگر کم بھی ھو گھر میں تو مسئلہ کیا ھے
3473,صدر کے قتل کے فورا بعد انہیں گرفتار کر لیا گیا۔
3474,ہاں بھئی نہیں آیا میں فائر فوکس استمال کر رہا ہوں
3475,اس میں مختلف مضامین ہیں لیکن زیادہ خراج کے مسائل ہیں۔
3476,فلسطینی عوامی پارٹی، فلسطین میں ایک معاشری سیاسی جماعت ہے۔
3477,سعود بھائی نے تو شرط والی بات ہی ختم کر دی
3478,آخر میں اس نے زرنگ عربوں کے حوالے کرکے صلح کرلی۔
3479,محمد آلوسی کا ایک فرزند تھا جن کا نام نعمان آلوسی تھا۔
3480,نیز متکبر، کبریائی والے اور عظمت والے کو کہتے ہیں۔
3481,418سیاست کانپور اردو زبان کے اخبار کی جدوجہد پر تھی۔
3482,کلاسیکی فارسی شاعرات میں ان کا نام سب سے بلند ہے۔
3483,مجھ کو آتے ہیں فقط چند لفظ ہی در فارسی
3484,وارث صاحب خوبصورت کلام شیئر کرنے پر آپ کا شکریہ
3485,ناک کی بالیاں عام طور سے صرف عورتیں ہی پہنتی ہیں۔
3486,اقبال شناسی کے لیے تحقیق و تدوین کے مواقع فراہم کرنا۔
3487,بہت سارے مبارک باد کے دھاگے رہ گئے مجھ سے
3488,"""وہاں """" پیغام بھیجنا """" والی ترجیحات میں ایک یہ ہے"""
3489,بلکل درست تجزیہ ہے اظہار صاحب کا بھی اور آپ کا بھی
3490,پہلے شاکر بھائی نے کیا خوب غن نا کہہ دیا
3491,دوسرے حصے میں اہم ترین میلے سبی میلہکاہر سال انعقاد
3492,ایٹمی ادارے میں ارجنٹائن بورڈ آف گورنرز میں شامل ہے۔
3493,بیٹھے جو تیری چھت پہ کبوتر ہی اور ہو افضال نوید
3494,غصے میں سانپ کی طرح بل کھاتا ہوا چلا جاتا ہے
3495,وہ تدریس اور تحقیق کا 44 سالہ تجربہ رکھتے ہیں۔
3496,ڈاکٹر انور سدید انشائیہ کی تعریف کرتے ہوئے رقم طراز ہیں
3497,کریگ انڈیانا انگریزی ریاستہائے متحدہ امریکہ کا ایک جو میں واقع ہے
3498,پیٹرزبرگ وسکونسن انگریزی ریاستہائے متحدہ امریکہ کا ایک جو میں واقع ہے
3499,ٹرائے ورمونٹ انگریزی ریاستہائے متحدہ امریکہ کا ایک جو میں واقع ہے
3500,علاوہ ازیں دو زبانی لغات اور ترجمانی لغات بھی دستیاب ہیں۔
3501,جس کو ہو جان ودل عزیز اس کی گلی میں جائے کیوں
3502,خطاطی کو چین میں فن کی بڑی شاخ گردانا جاتا ہے۔
3503,اس کے علاوہ یہاں کینیڈا چند بڑی جھیلیں بھی موجود ہیں۔
3504,مندرجہ ذیل میں موضوع وار راوین کی فہرست ہے۔
3505,مگر اس کا بڑا حصہ ایرانی مملکت میں شامل ہے۔
3506,آپ شام، ایران اور عراق کے حاکموں سے بھی ملی تھیں۔
3507,وہ وفا شعار اور با وفا لڑکی ہوتی ہے۔
3508,نیلوفر خاتون اگکے سلطان مراد اول کی والدہ تھی۔
3509,یہ دونوں پوسٹر آپ درج ذیل روابط پر دیکھ سکتے ہیں
3510,صحیح ابن العوانہ جس کا دوسرا نام مستخرج ابی عوانۃ بھی ہے
3511,میں جب منہ بند کر لوں تو بول نہیں سکتا
3512,میرے لہجے میں حسرت تھی اور رشک تھا نا کہ شک
3513,جی اچھا بھیا ویسے ہم پیتے ہیں ناں کھانے کے ساتھ
3514,یہوداہ یا تدی، یسوع کے بارہ رسل میں سے ایک تھے۔
3515,دور افق سے کوئی آ رہا تھا ادھر وہ کدھر رہ گیا
3516,اللہ رحم کرے اور عسکری کو شرطوں سے شر سے بچائے
3517,کہ جن کو دیکھ کر احساس کو راحت سی ملتی ہے
3518,کالج اور یونیورسٹی میں مقابلہ تقریر میں ہمیشہ اول رہیں۔
3519,سکھ ایجوکیشنل کانفرنس دی کی بھی دو بار سربراہی کی۔
3520,ہم پہ یہ فرض ہے ہر اک سے محبت سے ملیں
3521,اور غزل میں داخل اور خارج کی کشمکش جاری ہے۔
3522,فرانسسکو ڈی پیڈرو نے زیادہ بہتر مصنوعی پیس میکر بنایا۔
3523,میری جانب دوڑتے آتے ہوئے پھر رک واپس جاتے ہوئے
3524,ذیل میں افغانستان میں سفارتی مشنوں کی فہرست درج ہے۔
3525,بحیرہ احمر کا ساحل مندرجہ ذیل ممالک سے ملتا ہے :
3526,ابن قدامہ کے تین بیٹے تھے: محمد، یحیی اور عیسی۔
3527,آپ نے اپنی شاعری کا سفر غالبا سنہ میں شروع کیا
3528,""""""" کیا لکھ رہے تھے ۔ """" لڑکی نے پوچھا"""
3529,سیمی فائنل میں اس کا مقابلہ فٹبال کلب بارسلونا سے ہوگا
3530,ٹیگ : خاور ، شاعر ، غزل ، لاہور ، محمد خاور
3531,ان کی نماز جنازہ ان کے ساتھی محمد ہزاروی نے پڑھائی۔
3532,لیکن میں اپنی زندگی کی قسم کھا کر کہتا ہوں۔
3533,ان کی غزل کے موضوعات حسن اور عشق پر مبنی ہیں
3534,برنارڈو ہوسے لاطینی امریکا کے پہلے نوبل انعام یافتہ فرد ہیں۔
3535,جس میں سوار ہوکر جنگل کی سیر کی جا سکتی ہے۔
3536,میں کہتا ہوں اگر اس بار تم نے کوئی ایسی ویسی
3537,اندرانیل سینگپتا ایک بھارتی فلم اور ٹیلیویژن اداکار اور ایک ماڈل ہے
3538,اس میں آپ کو تاریخ کا مختصر حوالہ مل جائے گا
3539,جنات نے دنیا میں فتنہ و فساد برپا کر رکھا تھا۔
3540,بس 3 گھنٹے بعد ہلکا سا چکر آیا تھا
3541,دیگر چکوک جو شہر کے نزدیک ہیں درج ذیل ہیں ۔
3542,کوئی شخص اس کے مکان میں کسی اور شہر کا آ بسا
3543,شوکت حسین رضوی کی سوانح سنے پلاٹ ویب سائٹ پر
3544,نہیں بھیا میں ڈٹ نہیں گئی سمجھنے کی کوشش کر رہی ہوں
3545,آپ کیا کھاتے ہیں جو اتنے خوبصورت نظر آتے ہیں
3546,بزم جہاں میں یاد ہے آج بھی ہر طرف تیری 1
3547,ان میں رشی آریائی فکری خطوط کی نمائندگی کرتے ہیں۔
3548,کہ جس کو دیکھ کر خود خالق اکبر کو پیار آیا
3549,آج بھی سورج ڈوب گیا بے نور افق کے ساگر میں
3550,ارے نہیں بھائی یہ خنجر کوئی سلطان راہی تو نہیں ہیں
3551,میں بھی حاضر ہوں دل و جان سے چچا جانی
3552,لیکن شہری حکومت کی کی وجہ سے زبون حالی کا شکار ہےہ
3553,سوری شمشاد بھائی غلطی ہو گئی اب ذہن میں رکھوں گا
3554,تم ہی نے ہم کو سنایا نہ اپنا دکھ ورنہ
3555,لیکن میں سب سے کم عمر میل ممبر تو ہوں نا
3556,حزب اللہ لبنان عبرانی زبان میں چینل کا آغاز کر رہا ہے
3557,ویسے یہ پوسٹ تمہاری 5000 ویں پوسٹ تھی نا
3558,یہ جو ہم کچھ کہتے کہتے کچھ بھی کہ پاتے نہیں
3559,یہ بھی شاید یہ اوپر والے طوطے ہی کی نسل سے ہیں
3560,ہم عرب کے چرواہوں سے مقابلے کرنے کے لیے تیار نہیں ہیں۔
3561,تحریک آزادی اردو ادب کے آئینے میں۔ سنگمیل پبلیکیشنز لاہور،
3562,افغانی احناف کے امام اور بڑے زاہدوں میں شمار ہوتے ہیں۔
3563,آج گل گشت چمن کا وقت ہے اے نو بہار
3564,قلعے کے درمیان چند سیدھی دیواریں منہدم حالت میں ملتی ہیں۔
3565,یہ لفظ صلوۃ سے مشتق ہے جس کا معنی ہے: نماز۔
3566,1930ء میں سیاسی سرگرمیوں کی پاداش میں 3 سال کی سزا ہوئی۔
3567,آپ کے مقطع امالہ سے ان اشعار کو بھی تقویت ملتی ہے
3568,بلکہ یہ لوگ اسے اپنا مقدس فریضہ مانتے تھے۔
3569,اس وقت وہ مجھے گھوڑے کے ذکر پر یاد آیا -
3570,تیرا نام بڑی برکت والا ہے اور تیری بزرگی بلند ہے۔
3571,کیا خوب نظم کیا ہے سائنس اور روحانیات کو بٹ صاحب
3572,پاکستان اور جنوبی افریقہ کیپ میں پہلا ایک روزہ بین الاقوامی میچ
3573,بارش اور ہلکی سی سردی کے ساتھ آج میں بھی آگیا
3574,اسد الغابہ الحسن عز ابن الاثیر الناشر: دار الفکر بیروت
3575,چھ برس تک وہ اسی ضلع میں نظر بند رہے۔
3576,میں اس ہزار سے اپنے کپڑے لونگا باقی کا صدقہ دے دونگا
3577,ایک برکی روڈ، لاہور جبکہ دوسرا شیخوپورہ میں واقع ہے۔
3578,نایاب بھائی اور نیرنگ خیال بھائی کو بھی بہت بہت مبارک ہو
3579,انھیں 2015ء میں نوبل انعام برائے فزیالوجی اور طب ولیم سی۔
3580,اتنا نہ یاد آ کہ تجھے بھول جائیں ہم دد
3581,اردو مجلس کے حیدرآبادی نے ہمیں دعوت دی ہمیں یہاں آنے کی
3582,یہ غزل کچھ مشکل ہے لیکن مزے کی ہے بہت خوب
3583,ٹالسٹائی کے ابتدائی اور بعد ازاں ادبی رجحانات پر ایک فلسفیانہ
3584,جاسوسی دنیا ناول نمبر 102 ناول کا نام زرد فتنہ
3585,آبلہ پائی کا قرار گیا : از : فاتح الدین بشیر
3586,اور شہر کے سارے مناظر اندھیرے میں کھو گئے ہیں۔
3587,آپ کی بہن ہوں ناں اس لیے آپ کو لگتی ہوں بھیا
3588,حضرت عمر نے اپنے ماموں کو اپنے ہاتھ سے قتل کیا۔
3589,اسے 7 سال قبل ہی اس کے بیٹے امریکہ لائے تھے۔
3590,فالکن کو آخری دفعہ پایا گیا : جون 1 ، 2010
3591,مانو کو آخری دفعہ پایا گیا : جون 30 ، 2008
3592,اس کائنات رنگ و بو میں صرف دو وجود ہیں
3593,سعید بن مسیب، تابعی سات فقہائے مدینہ میں سے ایک۔
3594,غزل - یوں تو شمار اس کا مرے بھائیوں میں تھا
3595,یکی لشکری ساخت افراسیاب/ز دشت سپیجاب تا رود آب
3596,ان میں سے تین نمائندہ واقعات کی تفاصیل درج ذیل ہے۔
3597,ترقی یافتہ ممالک بچوں کی پیدائش پر مختلف رعایات دیتے ہیں۔
3598,پر میں تو اچھی بچی نہیں ہوں نا تو پھر کیسے
3599,پھر ہوموسیپینز یا انسان کے جسم کے بالوں کو کیا ہوا؟
3600,رسول اللہ صلیاللہ علیہ و علی آلہ وسلم نے فرمایا:
3601,چوڑے پتوں والے درخت بھی یہاں عام ملتے ہیں۔
3602,وہ حسن کے ایک تجربے کے طور پر قبول کرتے ہیں۔
3603,اس بلدیہ کی کل آبادی افراد ہے جو میں شمار ہوئی
3604,والدہ مرحومہ کی یاد میں کا فنی و فکری تجزیہ
3605,یہ آرام دہ ہے اور کسی چمکدار دھات سے بنائی گئی ہے
3606,ڈاکٹر کے پاس جایا کرو ورنہ جلدی ٹھیک نہیں ہوگی
3607,عورت تاریخ کے ہر دور میں مرد کے تابع رہی ہے۔
3608,بھئی وہ کہہ رھے تھے کہ کم کم آنے والے یہاں آئیں
3609,علی عظمت کے مشہور گانوں کی فہرست کچھ یوں ہے۔
3610,ایک شہر ہے جس کے اندر الگ الگ مکان ہیں۔
3611,تو کیا ہوا اجنبی بعد میں دوست یا دشمن بنتے ہیں
3612,اخیر تو آپ نے کرنا تھی بقول فرحت تشریح کر کے
3613,آپ نے کچھ نہ لکھ کر بھی سب کچھ کہہ دیا پیارے
3614,ہر ایسا عمل اس دفعہ کے تحت قابل سزا ہے۔
3615,واپس اندلس اور کچھ عرصہ قرطبہ میں درس دیتے رہے۔
3616,اپنے قیام کے دوران زرغنی محمد اقبال کے ربط میں بھی آئے۔
3617,سونے اور چاندی کے سکوں کے بہت سے فوائد ہیں۔
3618,متحدہ عرب امارات ایشیائی کھیل 2014 میں شریک ملک ہے۔
3619,توبہ توبہ یعنی میری وجہ سے آپ پریشان ہو رہی
3620,دگر طالقان شہر تا فاریاب / ہمیدون در بلخ تا اندرآب
3621,اس اچھے زمانے میں استاد مرشد ہوا کرتا تھا۔
3622,موجودہ دور میں کشمیری زبان کا فارسی زبان کے مطابق ہیں
3623,9 - آنکھوں میں بسا لیتا ہوں ہر رات میں جس کو
3624,لذت آتی جو لفظ الفت سے پڑھتے دائم الف کے آگے تے
3625,دریائے سندھ کے کنارے آباد ہونے کی وجہ سے کچھی بھی کہلایا۔
3626,ایک کلو کا بستہ اٹھانا ہنستے ہنستے پھر سکول کو جانا
3627,اے برق مرے حال پہ کھا کچھ تو ترس بھی
3628,یہ زبیر مرزا بھائی کے سٹائل کا ملٹی پل چوائس سوال ہے
3629,4 نومبر 1907ء کو میونخ یونیورسٹی نے ڈاکٹریٹ کی ڈگری دے دی۔
3630,کسی صورت بھی خاوند کو معذوری کا احساس نہیں ہونے دیتی
3631,سابق شاہ فاروق اول نے انہیں الکمال کا اعزاز دیا۔
3632,اور جن کے بزرگوار سے اس خاندان کی دیرینہ عداوت بھی تھی۔
3633,1923ء میں ہندوستان واپس آئے اور مسلم لیگ میں شامل ہوئے۔
3634,سعودی مفتی اعظم نے بوکو حرام کو گمراہ قرار دے دیا
3635,اس کا مشاہدہ آسمان جنوب چہارم میں کیا جا سکتا ہے۔
3636,اس کا مشاہدہ آسمان جنوب سوم میں کیا جا سکتا ہے۔
3637,السلام م علیکم جیہ کیا حال ہے روزے کیسے جا رہے ہیں
3638,40 سال کی عمر میں انہوں نے ریٹائرمنٹ کا اعلان کیا۔
3639,کافی دن ہو گئے ہیں انیس بھائی سے بات چیت کیے ہوئے
3640,مگر ماضی میں اور آج بھی خواتین اس سے اجتناب برتی ہیں۔
3641,اب اس لیے بھی ہمیں محبت کو طول دینا پڑے گا تابش
3642,ارے بھائی کوئی ہمیں بھی کہ الیکشن دنگل کہاں تک پہنچا ہے
3643,18 جنوری: نئی دہلی میں کونسل کا افتتاح ہوا۔
3644,ن م راشد: سیاست اور شاعری۔ دوست 2010ء، و
3645,خود تو کہا تھا جانے کی دعا دیں کیا کھایا ہے آج
3646,نیتا جی جب منھ کھولیں گے وہ غربت پر ہی بولیں گے
3647,کوئی بات نہیں اب اتنی بری عادت بھی نہیں ھے یہ
3648,مثلا سندھ کے میروں کو شروغ میں کلکتہ میں رکھا گیا تھا۔
3649,بعد میں وہ طویل عرصے تک ان لیبارٹریز کا پروفیسر رہا۔
3650,اس کے علاوہ امریکہ بری فوج میں خدمات بھی انجام دیں
3651,اپ ایک نئی قوم کے وجود میں انے سے منکر کیوں ہیں
3652,چلو جی آپ کے بہانے ہمارا مسئلہ بھی حل ہو گیا
3653,اس خبر کی شہرت کے سبب اسے مشہور کہتے ہیں۔
3654,"""کون جاہل شخص ہے جو احمقانہ باتیں کر رہا ہے """"؟"""
3655,میر بہادر علی حسینی فورٹ ولیم کالج کے میر منشی تھے۔
3656,میڈیکل یونیورسٹی آف لوڈز، پولینڈ کی طرف سے اعزازی ڈاکٹریٹ کی ڈگری
3657,حاضر ہیں تیرے دربار میں ہم اللہ کرم اللہ کرم
3658,تاکہ تمام علاقوں پر اچھی طرح تلسلط قائم رکھ سکیں۔
3659,ناز کو آخری دفعہ پایا گیا : دسمبر 13 ، 2008
3660,آسٹریلیا کے 28 اوورز میں 124 رنز 2 وکٹ کے نقصان پر
3661,کراچی منتقلی کے بعد جنگ اور انجام میں مقابلہ جاری رہا
3662,عرب ممالک میں یہودی کو اسی لقب سے پکارا جاتا ہے۔
3663,اور کوئی نہیں جانتا کہ ان لفظوں کا کیا مطلب ہے۔
3664,وہ لاہور میں شاہ نور اسٹوڈیو کے احاطے میں خاک ہیں۔
3665,اس لڑکی ویرا کے سامنے قاتل اپنے آپ کو ظاہر ہے۔
3666,اشرف نے تصوف کے فروغ پر خصوصی توجہ دی ہے۔
3667,اس پہ دل قربان اس پہ جان بھی قربان ہے
3668,عنایت خان کے والد ظفر خان بن خواجہ تھے۔
3669,ارجنٹائن کے ایٹمی پروگرام میں بیرونی معاونت اتنی زیادہ نہیں۔
3670,15 ۔ اس دن جھٹلانے والوں کے لئے خرابی و تباہی ہے
3671,شائد اس لیے کہ دشمن اس پر آسانی سے نہ چڑھ سکیں۔
3672,آدم عربی زبان میں انسان کے معنی رکھتا ہے۔
3673,۔اگر شوہر کسی کریہہ مرض میں مبتلا ہو جائے؛
3674,گھر کو گھر کے چراغ سے ہی آگ لگتی ہے بھائی
3675,یہ عجائب خانہ رنگ روڈ کے اطراف بنایا گیا ہے۔
3676,حروف شفوی: وہ حروف جو ہونٹوں سے ادا ہوتے ہیں۔
3677,لیکن معتبر روایت یہی ہے کہ آپ 24 ذوالحجہ کو متولد ہوئیں۔
3678,محمد یاسر علی بھائی نے مجھے اس بلاگ کے بارے بتایا ہے
3679,یہاں انہوں نے قانون کے ساتھ ادب کا بھی مطالعہ کیا۔
3680,یہ وقت بھی لد گیا تو پھر تباہی کے سوا کچھ نہیں
3681,مکے کے سب سے بڑے سردار اس وقت عبد المطلب تھے۔
3682,مدینہ میں رہتے ہوئے یہودیوں کو مذہبی آزادی ہوگی۔
3683,دیکھیں اب کیا فیصلہ آتا ہے کہ آج کل عدالتیں آزاد ہیں
3684,اہل کے نزدیک یہ مستند ترین کتب میں شامل ہے۔
3685,نہ عقل ماند نہ دانش نہ صبر ماند نہ طاقت
3686,اگست 2008ء میں اسے ویلور کارپوریشن کے ساتھ ملا دیا گیا۔
3687,صحابی جن کا اصل نام یسار اور کنیت ابو فکیہ تھی۔
3688,وہ اس ہیرے کو انسان سے یا دیو وغیرہ بن سکتا تھا
3689,سنہ1926ء میں سیتاناتھ سادھارن برہمو سماج کے صدر منتخب ہوئے۔
3690,چلیں غالب کی روح جنت میں کھیل کود پر لگ گئی
3691,بلوچستان کی بڑی زبانیں بلوچی، پشتو، براہوی اور فارسی ہیں۔
3692,اس کے لئے آپ آگے بیان کردہ طریقے کے مطابق عمل کیجئے
3693,اس کے بعد آپ نے مشہور یونیورسٹی علیگڑھ مسلم یونیورسٹی سے ایم۔
3694,درجہ 96 درج ذیل دو سے مربوط ہو سکتا ہے:
3695,درجہ 110 درج ذیل دو سے مربوط ہو سکتا ہے:
3696,احمد ندیم اور افسانہ نگار۔ سنگ میل پبلیکیشنز لاہور،
3697,حقیقی اعداد و شمار اس سے بھی زیادہ رہے ہوں گے۔
3698,بالکل سچ کہوں فرحت تو جاگتے میں خواب دیکھنا
3699,سریندر سائی قید میں 23 مئی 1884ء کو گزر گئے تھے۔
3700,ابن سینا اور فارابی کے معترف اور امام غزالی کے خلاف تھے۔
3701,بھئی یہ آپ اتنے نازک مزاج کب سے واقع ہوئے
3702,اب تو آپ کو ہر جگہ ٹیگ کر دیتا ہوں یاد سے
3703,لال مسجد کی نئی ویب سائٹ اب ان لائن ہے
3704,تینوں ابراھیمی مذاہب کا اس کے بارہ میں موقف مختلف ہے۔
3705,کائنات کے یہ حصے ہمارے موجودہ کائناتی افق سے پرے ہیں۔
3706,اور نا ماننے والوں کو مسیحیت کی دعوت دیتے تھے۔
3707,میر ولیاللہ ایبٹآبادی 1887 عیسوی میں کریالہ ضلع جہلم میں پیدا ہوئے۔
3708,2008ء میں آپ موگنا مانسو میں رادھیکا پنڈت کے ساتھ نظر آئے۔
3709,محمد اسحاق کو آخری دفعہ پایا گیا : نومبر 17 ، 2005
3710,ظلم و ستم کے ہر سو چھانے لگے ہیں بادل
3711,غزل پڑھنی شروع کی، جب اس شعر پر پہنچے کہ :
3712,محمد علی کا کہنا تھا کہ کیسیئس کلے ایک غلامانہ نام تھا۔
3713,عمران اج الطاف کے خلاف مقدمہ دائر کرنے لندن جائیں گے
3714,جبکہ حسرت موہانی ایک نیا تصور عشق سامنے لاتے ہیں۔
3715,ہینری پنجم کی موت کے ساتھ سالیان نسل ختم ہو چکی تھی
3716,تقریبا 90 ڈرامے لکھے لیکن صرف سات محفوظ ہیں۔
3717,ڈیسیپشن پوائنٹ کا آغاز اسی سوال کے جواب سے ہوتا ہے۔
3718,چنانچہ زندان شام کی روایت کے حسب ذیل ناقل ہیں۔
3719,تیری حکمت پہ سر تسلیم خم ہے کہ تم بادشاہ ہو
3720,[ اعدادوشمار ] پاکستانی بلے بازوں کی نااہلی کی طویل تاریخ
3721,دل صوفی یہ تھا ھم چل دیئے جہاں لے چلا
3722,آنکھوں میں اب کتنا نم ہے سینے میں کتنا دم ہے
3723,یہ لوگ عموما مادے کو غیر فانی اور متشکل تسلیم کرتے ہیں۔
3724,تقوی کا مطلب ہے پیرہیزگاری، نیکی اور ہدایت کی راہ۔
3725,دوسری پھر آپ اور تیسرے اپنے منہ میاں مٹھو جی بھی ہیں
3726,ان کا والد ابن سلول ان کی وجہ سے اپنی کنیت رکھتا
3727,وہ اس کتاب کے چھپنے کے ایک سال بعد انتقال کر گئی۔
3728,اور جب کرنسی غلام ہوتی ہے تو معیشت غلام ہوتی ہے۔
3729,زیادہ تر یہ دوسری شخص کی درخواست کے بعد ہوتا ہے۔
