,Stim
0,اس کے نے اس کی تربیت کی تھی
1,کہ اس کا اپنے قاتلوں سے کوئی بھی
2,برہما پیدائش کے لیے مستعمل لفظ سے مشتق
3,نہ بتانا مہ کشوں کو کہ پیامی ہے
4,شبنم جو گرتی ہے تو اٹھاتا ہے آفتاب
5,دیپ جلانے کا مزہ اور ہی کچھ ہے
6,پاکستان میں لڑکیوں کی تعلیم کے لیے جنگ
7,ازل سے میری ادھوری سی داستاں کے لیے
8,میکسیکو کے دیگر استعمالات کے لیے دیکھیے میکسیکو
9,یورپ کے مشہور ہیکل تراشوں سے بنوا کے
10,پاکستان کے خلاف بھی کسی بھی ٹیم کا
11,اور اس کی ینگ وائف اس سے پوچھ
12,اب آپ یہ بتائیں کہ یہ کیا ہے
13,اب کیا کر دیا ہے انکل میں نے
14,سٹریس کم ہوا کہ اور بڑھ گیا ہے
15,ہے آپ کی تسبیح و مناجات کی رات
16,اسیر ہو کے جسے شامیوں کے نرغے میں
17,گیا ایک دن اس کے کوچے میں ناگاہ
18,غم نے کی یاں سے رخش کو مہمیز
19,میں نے کہا پوچھو بیٹا کیا بات ہے
20,کچھ بندشوں کو چست کرنے کی ضرورت ہے
21,12 ویں رمضان المبارک 1425 ھ کو ہوگئے
22,کہ اپنوں ہی کے دل سے دربدر تھے
23,انہیں کی سالگرہ کے لئے ہے یہ توقیر
24,میں سکی کر کے چڑھا اور اترا گیا
25,مگر ہے ہی نہیں تو کدھر سے لاتی
26,قباحت کیا ہے آپ کا نام لینے میں
27,بانویا کے والد کے طور پر گھوشنھ راہرہ
28,جنرل مشرف کی سیاست میڈیا کے کندھوں پر
29,ہم تو تفریق کے ہندسے نہیں جوڑا کرتے
30,کہنے سے میر اور بھی ہوتا ہے مضطرب
31,ڈھیر پھولوں کے چڑھے عاشقوں کی قبروں پر
32,اس کا بھی دل نہیں کر رہا بھیا
33,اس میں بلوچستان کا شہر لورالائی شامل ہے
34,رتبہ سے تنزل کرے تو ظل ہما ہو
35,ہمارے خلف الرشید محمد عثمان خلیل کی کاوش
36,مینا شاہ کی پیدائش کے شہر بلرامپور 1937ء
37,سارہ بشارت گیلانی ، نومبر 26 ، 2012
38,فیصل عظیم فیصل ، فروری 9 ، 2010
39,محمد یعقوب آسی ، جنوری 7 ، 2013
40,محمد یعقوب آسی ، جنوری 12 ، 2013
41,فیصل عظیم فیصل ، جنوری 9 ، 2009
42,اس کو فیاضی سے میں نے بخشی یہ سوغات
43,یہاں تو آپ کا ہی طوطی بولتا ہے
44,خوگر نہیں کچھ یونہی ہم ریختہ گوئی کے
45,اور سنائیں آپ کی طرف موسم کیسا ہے
46,اور ہیروئین بھی رہبانیت کا لبادہ اوڑھ لیتی ہے
47,میٹھے پانی کے حوض کی مچھلیوں کی فہرست
48,یہ مغرب میں جو بادلوں کی ہے باڑ
49,جی اس کی ایک وجہ تو جینز ہیں
50,اب چاک رہا ہے نہ گریبان رہا ہے
51,وہ تو لمحوں کی پرستار بنی بیٹھی ہے
52,تو دیکھا کہ ریوڑ یہ بکروں کا تھا
53,کولا مشروبات کے استعمال سے کینسر کا خطرہ
54,بولیویا کی امریکی سفارتخانہ بند کرنے کی دھمکی
55,آپ کو بھولیں میں جو ہم کیسے کہیں
56,یہ بھی کوئی پوچھنے والی بات ہے بھیا
57,فرخ السلام و علیکم و رحمتہ اللہ :
58,کیا اس کا مطلب ہم یہ لیں کہ
59,جمالیاتی حس زوروں پر اور کام سے فراغت ہے
60,ہوا کے حکم کی تعمیل ہونے والی ہے
61,خدا کی خدمت تیمیہ کے رسالہ العبودیہ کا
62,مونس و دمساز مری آہ ہے فریاد ہے
63,اجاڑ دے میرے دل کی دنیا پر تبصرے
64,قیامت پھر رہی ہے تیری مستانہ نگاہوں میں
65,رہبری کی دہن یار کی جانب خط نے
66,یہ قیل و قال کا دیتے ہیں منشور
67,اس میں دودھ بھی تو ہونا چاہیے تھا
68,ہم جانتے ہیں اس کا محرک کیا ہے
69,انٹرنیٹ مووی ڈیٹابیس پر حمد بن خلیفہ الثانی
70,نہ ستا پہنا بھی دے یہ کنگنا دیوداس
71,پاکستان بدعنوانی کے گراف میں اور بھی نیچے
72,مگر سوال زمیں کی بھی آبرو کا تھا
73,وعلیکم السلام سارہ کیا حال ہیں آپ کے
74,ابھی تو راوی چین ہی چین لکھتا ہے
75,م کی بات کردی آپ نے شمشاد بھائی
76,امریکہ تک ان قبائلیوں کی پہنچ نہیں ۔
77,محمد بلال خان ، جنوری 8 ، 2013
78,لیا اس سے جاکر خبر اور اثر کو
79,فخر کس چیز کا ہے ان کے تئیں
80,ایسی ذلت کہ نہیں جس کا مداوا کوئی
81,کوئی ہم میں سے رہ گیا ہے کہیں
82,متن میں مذکور الفاظ سنن نسائی کے ہیں
83,زیک کے اس پیغام کے مطابق 06 جولائی 2007
84,دوست یہ آپ سے کس نے کہ دیا
85,جب آدی کے پیٹ میں آتی ہیں روٹیاں
86,لیں میں تو آگئی پر آپ کہاں ہے
87,ہندستان کی نوابی ریاستیں تا مالدیپ سکم سراواک
88,اور میں انتظار بھی شروع کر دیا ہے
89,اپنی مرضی سے سجاوٹ کر کے سرو کریں
90,اور آپ سب کو معلومات فراہم کی ہے
91,بہر حال دہریت بھی ایک بہانہ ہوتی ہے
92,خود ہم بکھر گئے تیری زلفیں سنوار کے
93,آپ نے تو دل گارڈن گارڈن کر دیا
94,اللہ سدا مہربان رہے آپ سب پر آمین
95,ٹیگ : ڈاکٹر کلیم عاجز ، کلیم عاجز
96,اور چکن کے لیے پانی کی ضرورت نہیں ہے
97,وار فکشن کے حوالے سے افسانوں کا ایک
98,وہ سنہ 2013ء سے کنیست کے اسپیکر ہیں۔
99,معشوق جو تھا اپنا باشندہ دکن کا تھا
100,آیئے ہم آپ کچھ اسلام کی باتیں کریں
101,ارے آپ نے اس کو جگا کر سوپ بنوایا
102,اوہو میرے پاس پرس ہوتا ہی نہیں ہے
103,آپ سے تو میں پہلے ہی ڈرتا ہوں
104,میری حمیت خاطر کا وہ ساماں بھی گیا
105,جس کے ہنگاموں میں ہو ابلیس کا سوز دروں
106,سعود بن سعید ، جولائی 23 ، 2009
107,اس سے پہلے کہ میں اس سے کچھ پوچھتا
108,کہ ہم نے پتھروں میں عمر کاٹی تھی
109,میں بھیا کی لاڈلی بہن ہوں اس لیے
110,اس لیے اس کا نام بروڈ پیک ہے۔
111,ان عفو و تحمل اور روش کی متانت
112,خلل پذیر بود ہر بنا کہ مے بینی
113,""""""" ہاں اس کی وجہ یہی ہے """""""
114,دھوکے سے اس حسین کو اگر چوم بھی لیا
115,تیرے بغیر کہیں بود و باش کیا کرتا
116,کو بہ کو پھیل گئی بات شناسائی کی
117,یہ کیسی باتیں شروع ہوگئی ہیں یہاں پر
118,سیدہ سعیدہ کے یونانی حکیم کی دختر تھی۔
119,اک دوسرے کے ہمسفر میں اور میری آوارگی
120,جس چیز کو زندگی کا دیتے ہیں لقب
121,تیر بھی لیکن بہت سے دیئے گئے ہیں
122,گھسے سب ناخن تدبیر اور ٹوٹا سر سوزن
123,اور بابائے ٹیگ جیسے قیمتی القابات جیتنے کے بعد
124,میری طرف سے یہ پھول آپ کے لئے
125,اس حدتک تو میں موٹی ہو نے سے رہی
126,ہاں یہ تو آپ نے بلکل ٹھیک کہا
127,ایک زمانے کے بعد ہم بھی آگئے ہیں
128,تیز ہے دریائے دل اپنی روانی میں بہت
129,اس کا کرتب مہابھارت میں بیان ہوا ہے۔
130,میں نے وہ اسٹوری بھی ٹائپ کر دی ہے
131,محمد بلال اعظم ، جنوری 18 ، 2013
132,محمد بلال اعظم ، فروری 3 ، 2013
133,محمد بلال اعظم ، جولائی 16 ، 2013
134,جن کی آنکھیں نہیں وہ نہ روئیں کبھی
135,بھائی سے بھائی کے کچھ تقاضے بھی ہیں
136,یہ دل یہ نظر یہ دہن یہ زباں
137,کچھ مشکلیں ایسی ہیں کہ آساں نہیں ہوتیں
138,آسمانی قلعے شیطان کی پہنچ سے محفوظ ہیں
139,نیچے دھرتی بدلی سر پر کوئی آکاش نہیں
140,بات کو ایک وضاحت سے شروع کر ۔
141,دو تصدفی متغیر سمتیہ اور سمتیہ کے درمیان تضایف
142,جب سے تم سے آنکھیں چار ہوئیں ہیں
143,انگولا سے زائر تک سیاست کے حوالے سے ایک
144,تو مقتدر ہے خدایا یہ التجا سن لے
145,جبکہ معزز مہمان سٹیج پر جلوہ افروز ہیں
146,غلام ربانی فدا ، ستمبر 28 ، 2013
147,گپ شپ میں کیا گپ ہو رہی ہے
148,میں تو پیداوار ہوں سستے زمانے کی میاں
149,آنکھوں سے کر رہے ہیں بیاں اپنی کیفیت
150,مزید اس صفحہ پر ملحظہ کریں جزائر ایران
151,اور قوم مختلف دھاروں میں بہہ رھی ھے
152,کھیلے ہوئے تو ساتھ کے پہنچے بہشت میں
153,کہ آئے تھے کیونکر اور کیا کر چلے
154,بی بی سی کی خبریں اختصار کے ساتھ
155,نہیں ہوگا ناں بھیا کل بھی کھائی تھی
156,تاکہ ان کی محنت سے سب مستفید ہوسکیں
157,جارج فہیر کے ساتھ کیمسٹری میں وولف پرائز
158,روشنی دن کے اندھیروں میں سمٹ جاتی ہے
159,قیصرانی ، پیر بوقت 12 : 17 شام
160,جیہ ، پیر بوقت 6 : 00 شام
161,قیصرانی ، جمعہ بوقت 3 : 22 شام
162,آپ صلی اللہ علیہ و سلم نے فرمایا
163,اس میں بریک کی اجازت نہیں ہے محسن
164,جہاں میں روز واک کے لئے نکلتی ہوں
165,کسی زنداں کی ضرورت ہی نہیں پیش آئی
166,کسی کے تیر ہوں لیکن کمان اس کی تھی
167,پنجاب اور سندھ کے علاوہ بلوچستان میں بھی۔
168,آسٹریلیا نے وہ میچ پانچ وکٹ سے جیتا
169,وہ وہ نکات اٹھاتی ہے یہ حکومت کہ
170,کہ تیرے خون سے قائم ہے اس کی شادابی
171,دے کر کیاجاتا ہے روشن جن چراغوں کو
172,کسی نے پیش کیا ہے بڑھا چڑھا کے مجھے
173,یہیں سے ان کی اس خلش کا آغاز ہوا
174,یاد رکھنا تو ساغر کی اس بات کو
175,اور اکثر تو اشکوں میں دھل جاتے ہیں
176,ییاتی کے دو بیٹے پورو اور یادو تھے۔
177,ساقی کے گیسو کی ہوا کھا رہا ہوں
178,یہاں بلاگ تھیم کے کوڈ میں اس کوڈ
179,ان کی تحریروں میں غضب کی دلکشی اور تاثیر ہے
180,کام کی باتیں کرتے ہیں محمد بھائی آپ
181,میرا تو کوئی پیپر رات کو نہیں ہوا
182,مونسون بادلوں اور بارشوں کا ایک سلسلہ ہے۔
183,یہ تو بالکل پھیکے پٹ کباب بنیں گے
184,اللہ آپ کے علم میں اور اضافہ کرے
185,اور ٹانگوں کی ہڈیاں دونوں ایک جیسی ہیں
186,رات نم نم ہے اور بس میں ہوں
187,اس میں کے عملے کی گنجائش ہوتی ہے
188,مجھے یقیں ہے گھنے بادلوں کے سائے میں
189,ایم اے راجا ، اگست 2 ، 2008
190,محمد شمیل قریشی ، جولائی 22 ، 2006
191,اور ہم نے لیٹ ڈنر میں چپلی کباب کھائے
192,اس میں اپنے ڈراما کو قسطوار شایع کیا۔
193,ریاضی اور فلسفے کے مضامین کے ساتھ گریجویشن کی۔
194,کہ کوئی اور ثمر کاٹنے کو آتا ہے
195,چلیں اس بہانے ہمیں حسین تو مانا آپ نے
196,یاسر عمران مرزا ، فروری 17 ، 2009
197,شمعون کے فرقہ میں سے سافت بن حوری
198,یہودا کے فرقہ میں سے کالب بن یفنہ
199,ہماری تو بڑی دیر سے یہ حسرت ہے
200,ہی ہی ہی ہی ہی ہی ہی بھیا
201,وہ صوقلو محمد پاشا کے عم زاد تھے۔
202,میں نے یہ تو سوچا ہی نہیں تھا
203,حضرت انس بن مالک سے مروی ہے کہ
204,سبزہ نو رستہ اس گھر کی نگہبانی کرے
205,نیوزی لینڈ 46 اوورز میں 217 پر 7
206,جی آپ کا بھی کر رہا ہے نا
207,اور بھی دوسری کتابیں ہیں ان کا کیا ہوگا
208,بس زیادہ بات ہی تین سے ہوتی ہے
209,اس زمیں کا ہر ذرہ آفتاب تم سے ہے
210,وہ لوگ آنکھوں سے اوجھل ہو گئے ہیں
211,موجودہ کے بنتو میں یہ مسئلہ نہیں ہوتا
212,خواب کی راکھ سمیٹے گی بکھر جائے گی
213,مزدوری مزدور کی محنت کا صلہ ہوتی ہے
214,اس کے پیچھے کہانی یہ بیان ہوتی ہے کہ
215,ہوسکتا ہے رات کو ملاقات ہو بشرط زندگی
216,ملنا ترا اگر نہیں آساں تو سہل ہے
217,اور یہ چیز کوئی استاد نہیں سکھا سکتا
218,یا رسول اللہ صلی اللہ علیہ وآلہ وسلم
219,مرے سر پر ہو گیان امرت کی برکھا
220,آپ اور پہلے عذر جفا اس نے جب کیا
221,آغوش میں مسلم کے وہ دلبر نظر آئے
222,پولیس کے مطابق آصف فلور ملز میں ۔
223,نبھائی تھی نہ ہم نے جانے کس سے
224,پیش کیوں کرتے ہو شیشے کے مشابہ خود کو
225,میری چاہت تیرے پندار کا مر جانا ہے
226,کیا پتہ کوئی سارہ خان سویٹ بھی ہو
227,صوفیا اور قرآن تبلیغی نصاب کی روشنی میں
228,مجھے تو یاد نہیں صحیح طرح سے بھیا
229,اگر جو ہے تو تڑپتا دکھائی دیتا ہے
230,ہے وقت اب بھی کشتیاں لے موڑ کے
231,سید اسد محمود ، فروری 15 ، 2013
232,باتیں سنتا میں کبھی پوچھتا معنی ان کے
233,سارہ بشارت گیلانی ، مئی 29 ، 2013
234,محمد شکیل عطاری ، مئی 30 ، 2012
235,فیصل عظیم فیصل ، مئی 7 ، 2009
236,محمد صغر بن علی میدانکربلا میں شہید ہوئے
237,ایویں میں خود بھی پھسلا جا رہا ہوں
238,کہتے نہیں لیکن کر تو سکتے ہیں نہ
239,ابھی تو سوئے تھے مقتل کو سرخرو کر کے
240,آپ نے کوئی چاند چڑھایا ہو گا ہ
241,وہ بات کہتے کیوں ہو جو کرتے نہیں
242,اپنی اپنی ذات کی طناب میں کسے ہوئے
243,مہدی نقوی حجاز ، جولائی 5 ، 2012
244,مہدی نقوی حجاز ، اپریل 28 ، 2013
245,گریاں نہیں تو یاں سے نکالے ہوئے تو ہیں
246,سب دیکھ دیکھ اس کو بجاتے ہیں تالیاں
247,کہ ذرہ ذرہ دریچہ ہے تازہ چہروں کا
248,اچھا تو آپ کا نام عمر ہے گڈ
249,وہ بہادر بھی ہے اور نڈر بھی ہے۔
250,مرا مقصد فقط شعلہ نوائی ہو نہیں سکتا
251,پتہ نہیں کیا بات چیت ہورہی ہے یہاں
252,""""""" نہ ہی فون میرے پاس ہے """""""
253,ترا علاج ڈنر کے سوا کچھ اور نہیں
254,یہ کشمیر مغرب اور مشرق کو جگائے گا
255,بلوچستان کے ضلع چاغی کا ایک شہر ہے۔
256,دل ہی دل میں وہ خفا ہو جیسے
257,اس کا جواب آیات میں دیا گیا ہے
258,ڈیلفی یونان کے جنوب وسط میں واقع ہے۔
259,اعتراض تو اس پر بھی کوئی نہیں کرتا
260,مجھے لگتا ہے جیسے میں جانتی ہوں انہیں
261,میں خود کو نہیں دیکھتی اوروں کی نظر سے
262,محبت نے جھکایا ہے سر اچھے اچھوں کا
263,عمار ابن ضیا ، اپریل 28 ، 2008
264,عمار ابن ضیا ، جنوری 6 ، 2009
265,عمار ابن ضیا ، جنوری 1 ، 2009
266,عمار ابن ضیا ، فروری 22 ، 2008
267,کونین کی تعمیر میں مصروف ہے دن رات
268,کیا کہیں آپ سے قول ہارے ہیں کیوں
269,کیا ہی گہر ائی کا حامل کلام ہے
270,ان کی پاکی کا خدائے پاک کرتا ہے بیاں
271,اور اب چمچے نے میرے گال سجا رکھا ہے
272,دن کو پروانے سے صحبت رات کو سرخاب سے
273,مجھے تو اور کوئی کام بھی نہیں آتا
274,کچھ وقت چاہتے تھے کہ سوچیں تیرے لیئے
275,پھر جو اس نے کہا کیے ہی بنی
276,انڈس ریسورس سینٹر کی بانی اور ایگزیکیوٹو ڈائریکٹر
277,چلیں شمشاد بھائی اب آپ کی باری ہے
278,اپنا تو کسی سے بھی ستارہ نہیں ملتا
279,ایک کالا کتا پیشاب کر آئے گا ۔
280,کیوں کہ مجھے کسی سے جاگیر نہیں درکار
281,شیر کی نیت اور بکری کی عقل میں فتور
282,گزارش ہے کہ کھل کر تنقید کی جائے
283,میں اس کا دل جوابوں سے ٹٹول لیتی ہوں
284,ملٹی وائبریٹر سرکٹ کی تین قسمیں ہوتی ہیں۔
285,رستم کے اسلاف میں ایک نام گرشتاب تھا۔
286,فرہاد بہ پیکر چو منوچہر و قباد است
287,ایک تیلی لڑکا جو تیل بیچ رہا تھا
288,ہم پہ جو گزری وہ ہم سے پوچھو
289,پر یہ تو ہر اقتباس کے ساتھ بڑھ رہا
290,ان کے خاندان کا نام انڈو یورپین زبانیں ہے
291,پانی کے دو گھونٹ چڑھا کر رقص کیا
292,پر وصل سے بیزاری ہونے والی با ۔
293,بات نکلی تو بہت دور تلک جائے گی
294,اس نے زرہ بکتر اور خود پہنا ہوا تھا
295,سالم آرگنائزر کے طور پر سلیم خان ڈنگ ڈونگ
296,گھر جلانے کو مرا لوگ جو گھرمیں آئے
297,اب میرے رخت میں باقی نہیں ساماں کوئی
298,جو اذن ہو تو تیری یاد سے گزر
299,نایاب الف عین نیرنگ خیال فلک شیر جیا
300,تیرے سینے کا نہاں خانہ عجائب خانہ ہے
301,مراسلہ تسلیم خم ہے جو مزاج امین آئے
302,ساری باتیں ٹھیک کہیں آپ کے قاری نے
303,کیا کیا توقعات تھیں آہوں سے اے خمار
304,ہم اپنے آپ کو محفوظ سمجھیں یا قیدی
305,اونگ کی بادشاہت چین کی آخری بادشاہت تھی۔
306,شیراد کلکر اور راجشری ٹھاکر ڈراما سات پھیرے سے
307,سب کام سہی طرح سے ہو گیا ہے
308,دلوں میں اپنے چھپائے پھرتے ہیں کوچہ کوچہ
309,کتنا بورنگ کام ہے ناں پیپرز چیک کرنا
310,دیں ہمہ اوست از سید نصیر الدین نصیر
311,میرا خیال ہے سری لنکا کے ساتھ ہوگا کیا
312,لاڑ ریلوے اسٹیشن لاڑ ملتان میں واقع ہے
313,یہ سب جب آپ مطالعہ کر چکیں تو
314,شکست دے گیا اپنا غرور ہی اس کو
315,مل جائے آپ کو دنیا کی ہر خوشی
316,گلیاں ہی گلیاں ہیں - اشوک چکر دھر
317,رسول اللہ صلی اللہ علیہ وسلم نے فرمایا
318,بمبئ میں آپ کی دوسری شادی ہوئی ۔
319,سنا ہے عشق کا آزار ہوگیا ہے مجھے
320,عدم کی گرد میں نہاں ہے کاروان زندگی
321,وہاب اعجاز خان ، ستمبر 26 ، 2007
322,اس کا دامن کسی اجنبی نے نہیں دیکھا
323,کہیں دنیا سے ہی کوچ نہ کر جانا
324,لنکن مسوری کا رقبہ مربع کیلومیٹر ہے ہے
325,اکثر اس زبان کو میمن لوگ بولتے ہیں
326,ایک گزارش ہم نے بھی کر رکھی ہے
327,امن و آزادی کے ہم تو ہیں نقیب
328,کا نام ہند اور کنیت ام سلمہ تھی
329,جو لوگ تیرے پیار کی ضد پر اڑے رہے
330,اس کے بعد پنچاب اور بلوچستان فتح ہوئے۔
331,آجکل تو جاوید چودھری کمال کر رہا ہے
332,قدرتی قسم کے وراثے ان کی مثال ہیں
333,مانو ٹھیک نہیں ہوں سر میں درد ہے
334,آپ صلی اللہ علیہ وسلم رحمت اللعالمین تھے
335,آپ کی تو پھر سن لیں گے سب
336,موت پر ہوتی ہے کیا تنقید آکر دیکھتے
337,آپ کے چند کالموں کے نام یہ ہیں:
338,رات درویش کی تربت پہ تھے گریاں تارے
339,ہم نے اپنوں کی خوشیوں پہ واری خوشی
340,ابھی اس بات کا کسی کو پتا نہیں
341,طور پر کافر گیا کافر سے ملنے کے لیے
342,اس دیس میں ٹھکانے کے دن بیت ہی گئے
343,ہم سب جانتے ہیں ان کے بارے میں
344,ہتھے جو چڑھ گئے کبھی سسرال کے جناب
345,آپ کہتے ہیں تو زنجیر ہلا دیتے ہیں
346,بالکل اصلی پستول کی نقلی بلٹ کی طرح
347,آپ سیدنا کے خاص شاگردوں میں سے تھے۔
348,تو پھر مجھے اکیلے کیوں چھوڑ دیا ہے
349,نہیں عمران جس کو علم کچھ انجام کا
350,سنیئر کہیں آپ ہمیں بوڑھا تو نہیں کہ رہے
351,لے کے چلتا ہوں خیالوں کا سفینہ اپنا
352,ساتھ میں کوئی چپس وغیرہ بھی پکڑ لینا
353,کیونکہ اس کا گوشت کھایا جاتا ہے اس لئے
354,گھر کا آنگن حسین خوشیوں سے مہک جائے گا
355,آج ہی کھائی ہے مفت کے مال سے
356,1940ء میں مسلم لیگ میں شمولیت اختیار کی۔
357,مزید معلومات کے لیے دیکھیے : قوانین کرکٹ
358,ان میں سے کوئی رستہ ادھر کیوں نہیں جاتا
359,یوں تو عیاشی میسر ہے زمانے بھر کی
360,31 دسمبر ہوگیا ہے ابھی شام نہیں آئی
361,میں اللہ سے بس یہ دعا مانگتا ہوں
362,جنہیں عاشقوں نے چاہا کہ فلک سے توڑ لائیں
363,پٹریاں ممباسا سے کمپالا کی جانب جاتی ہیں۔
364,جو گرد اڑ کے گئ ہے ملال میرا تھا
365,اور بلوچستان کی خطرناک جیل مچھ جیل بیجھا گیا
366,زمین کا دیرپا استعمال کی صلاحیت رکھتا ہے۔
367,سنو بہار سے پہلے خزاں تو رہتی ہے
368,پاکستان کے شہر لاہور کا تاریخی دروازہ ہے
369,اس چراغاں کا کروں کیا کارفرما جل گیا
370,چیمپئنز ٹرافی کے لیے بھارتی ٹیم کا اعلان
371,ان کا یہ شعر تو ضرب المثل ہے
372,اسلام تے کفر دی جنگ ہون والی اے
373,اور وہ بھی دونوں بلکہ چاروں طرف سے
374,استانی نے مسکراتے ہوئے اس کے گال چھوئے اور کہا
375,کوئی نہ سہہ سکے لہجہ کرخت ایسا تھا
376,تو اپنی رضا سے کیا ہے یہ ہم نے
377,ردیف و قافیہ کا فرق تک نہیں معلوم
378,آپ کے سرچ وارنٹ جاری کر دئیے گئے ہیں
379,لگاتا پھر رہا ہوں عاشقوں پر کفر کے فتوے
380,کیسے کیسے ارمان دل میں ھی رہ گئے
381,سرچ انجن وغیرہ میں ویب سائٹ کی شمولیت
382,وے لطف کی نگاہیں پہلے فریب ہیں سب
383,امید ہے اس شکایت کا ازالہ ہوجائے گا
384,کہ جن کے خوں سے ترے رنگ تابناک ہوئے
385,اللہ جی یہ تو مذاق کا اسٹائل تھا
386,شمشاد بھائی بالکل صحیح جواب ہے آپ کا
387,ظہور احمد سولنگی ، اکتوبر 3 ، 2007
388,تیری نگاہ سے دل سینوں میں کانپتے تھے
389,بیوی کا دف اولاد سے مارا جاتا ہے
390,ء میں ان کے مرنے کی تصدیق ہوئی
391,وہ کہہ گیا تھا یہی وقت امتحاں کا ہے
392,میں اس کے انبوہ میں اکثر کھو جاتا
393,قرآن کے حافظ بھی تھے اور عاشق بھی۔
394,پر جوگی دے حاجی تے ٹھنڈ اے ۔
395,اور انصاف کی فراہمی بہت بہت ضروری ہے
396,او عدم کے جانے والے یہ وفاداری نہیں
397,سکول اور کالجوں کے لئے تعلیمی رنگ کا
398,ہم جلد ہی اپنا تعارفی دھاگہ کھولتے ہیں
399,آج یوم پاکستان کے حوالے سے کچھ اسپیشل
400,خم تیری زلف کا دیکھ کر یاد آیا
