,Stim
1521,گرمکنڈہ میں سالانہ مشاعروں کے انعقاد میں تعاون۔
1522,واہ کیا خوب لکھا ہے نیرنگ خیال بھائی
1523,منیر انور صاحب کی سمجھ میں آ گئی ہے
1524,کاٹے کبھی منہ سر کبھی گردن سے اڑائے
1525,آپ کہیے کیسے ہیں اور کیا معمولات ہیں آج کل
1526,بنیادی طور پر یہ معاشیات کی ایک اہم شاخ ہے
1527,خود کو بھی خبر ہونے نہیں دی کبھی اپنی
1528,روتے روتے بیٹھ گئی آواز کسی شیدائی کی
1529,اول اول کا عشق بھی یاد ہے فراز
1530,ہرے گھر میں رہنے والے کو کافی پسند ہے
1531,ظلم کی طرح اذیت میں ہے جس طرح حیات
1532,اس آیت کا ترجمہ بعض لوگوں نے یہ کیا
1533,16 اوور کی پہلی بال پر ایک اور وکٹ
1534,تقدیر کی درج ذیل تین اقسام ہیں :
1535,اب غزل ایک نئے تصور کے تحت ہے۔
1536,39 ۔ شاعری کے لیے کیا کیا شرطیں ضروری ہیں
1537,جاہ و حشم وہ شان وہ شوکت نہیں رہی
1538,آگے کی تعلیم کے لئے اسلامیہ کالج لاہور گئے تھے
1539,پہلے حصے کا تعلق انصار و مہاجرین سے ہے۔
1540,آتے جاتے ہوئے موسم تھے زمانہ تو تھا
1541,انھیں 1959 میں کیمیاء کو نوبیل انعام دیا گیا۔
1542,پھر اس کے بعد ہے وہ سنہری مکاں کا شہر
1543,ہاں تو بزرگوں آپ ٹھیک ہی کہ رہے ہونگے
1544,182 آپ کی طویل ترین انفرادی اننگ ہے۔
1545,بات یہ تیرے سوا اور بھلا کس سے کہیں
1546,کلور کوٹ ریلوے اسٹیشن پاکستان میں واقع ہے۔
1547,کراچی تا راولپنڈی براستہ حیدر آباد روہڑی ملتان اور لاہور
1548,اور شائد آج بھی انکی باقیات یہی کچھ پڑھاتی ہوگی
1549,یہ آپ بھائیوں کا اور مہ جبین آنٹی کا معاملہ ہے
1550,اسٹینفورڈ برائے فلسفہ پر زندگی سے مطابق مضمون
1551,نگاہ ہم اٹھاتے ہیں جس سمت کو بھی
1552,اس ایئرلائن کو 2004 میں حبیب علوی نے شروع کیا۔
1553,ہاں کچھ دنوں تو نوحہ و ماتم ہوا کیا
1554,جاسوسی سے زیادہ ہم کمانڈو ایکشن والے آدمی ہیں
1555,جس طرح نفیس فونٹ کا نمونہ وکیپیڈیا پر دیا ہے
1556,اسی امید پہ میری طرف وہ آیا ہوا ہے
1557,تب یہاں ایمان کی کھیتی ہری ہو گی
1558,یہ کبھی آگ میں ہوتا ہے کبھی پانی میں
1559,تو نے اے غافل گریباں میں بھی دیکھا ہے کبھی
1560,امانت کی طرح رکھا زمین نے روز محشر تک
1561,افضل، ایران مشرقی آزربائیجان اور ایران کا علاقہ
1562,ان خلیوں کی کمی اس مرض کا باعث ہوتی ہے
1563,پھر محفل میں کون مراسلے ارسال کررہا تھا
1564,کم از کم چھ ماہ تو رہوں گا انشااللہ
1565,سوچوں میں ڈوبنے سے بھی لکھنا نہ آ سکا
1566,تراجم مرحلہ 1 سے 4 تک مکمل ہو گیا ہے
1567,سبحان اللہ ۔ بہت عمدہ محمود احمد غزنوی صاحب
1568,آپ نے کیا سنانا ھے سنائیں میں سن رھی ہوں
1569,بہت خوب لکھا ہے آپ نے مغل بھائی
1570,کیا کروں ہو گیا دل اب تو گرفتار مرا
1571,یونان نے بھی اپنی آزادی کا اعلان کر دیا۔
1572,شور اتنا تھا کوئی بات نہ ہونے پائی
1573,پولیس مطمئن کرے تبھی تعاون ہوگا : جرگہ
1574,لال گلی سے گزری ہے کاغذ کی کشتی
1575,میں تو بس نقل کرنا ہی جانتا ہوں
1576,اور ایک اور مقام پر یوں ارشاد فرمایا:
1577,جوں شمع چھوڑنے کی نہیں یہ زباں مجھے
1578,اس واقعہ کا اسلامی نام شیطانک ورسز نہیں ہے۔
1579,وہ ایلیاڈ اور اوڈیسی جیسی شاہکار رزمیہ نظمیں لکھیں تھیں۔
1580,انھیں کمرے کی بوسیدہ چھتوں سے ڈر نہیں لگتا
1581,شگفتہ بہن آج کا اسکور کچھ یوں رہا
1582,اس شعر کو یوں بھی دیکھیے گا ازراہ کرم
1583,لکھنے پر تو پھر اس کاش کا کیا کام
1584,یعنی زمین کی گردش میں فرق واقع ہونا
1585,وہ مصرع تھا کہ اک گل رنگ چہرہ
1586,کچھ لوگوں کا ہے یہ کہنا یہ بھی ایک اداسی ہے
1587,اس قسم کے واقعات کبھی کبھی ہوا کرتے ہیں
1588,اس کا بیٹا بھوج ایک کامیاب اور قابل راجہ تھا
1589,' آپ کو دیکھ کر دیکھتا رہ گیا '
1590,اس اسکول سے فارغ التحصیل چند نمایاں طلبہ
1591,اف حجاب نام دیکھو اور پھر اپنا پیغام
1592,ان کی وفات جنوری 2018ء میں کراچی میں ہوئی۔
1593,عمر بھر سفر ہی تو پھر نصیب ہوتا ہے
1594,بعد میں غلامی کو ترک کر دیا گیا۔
1595,میں کراچی کے غم میں نہیں گھل رہا ہوں ۔
1596,ان حالات میں بادشاہت برائے نام ہی تھی۔
1597,اب ہم چلتے ہیں ذرا بس اسٹاپ تک
1598,ہالی وڈ : آسکر ایوارڈز کی تیاریاں مکمل
1599,وسیم اکرم بھی پاکستان کے لیئے ایک اعزاز ہیں ۔
1600,انہوں نے پاکستان کے اقوام متحدہ میشن میں شرکت کی
1601,مینا شاہ اپنے والد کی اکلوتی اولاد تھی۔
1602,جس کو ساتھی مل گیا وہ اور تنہا ہوگیا
1603,اسی طرح کچا پاپڑ پکا پاپڑ بھی مشہور ہے
1604,جن کی سانس کا ہر جھونکا تھا ایک عجیب طلسم
1605,میں رات ایسے جزیرے میں تھا جہاں مجھ کو
1606,یہ مقابلے ایشین سرکل کبڈی قوانین کے تحت ہوئے۔
1607,ورثے میں اگر ماں کی دعا بھی نہیں ملتی
1608,اس میلاد نامے کا آغاز حمد سے ہوتا ہے۔
1609,عجیب ہی ماجرا بیان کیا ہے خرم میاں آپ نے
1610,میں مطمئن ہوں بہت فرض یہ ادا کر کے
1611,یہ ہر سال 7-9 جنوری منائے جا رہے ہیں۔
1612,بوڈیگارڈ صدیقی کی طرف سے ایک بھارتی فلم ہے۔
1613,نظر جو آتا نہیں آس پاس ہو کر بھی
1614,جرنل ایشیائی اور یورپی شمارے بھی جاری کرتا ہے۔
1615,کولس کو بہت زیادہ پانی کی ضرورت نہیں ہوتی۔
1616,اتنی پیاری مبارکباد کا بہت شکریہ کھوکھر بھائی
1617,لکھا ہوا نے کہ بس میری آخری حد ہے
1618,جب کا گورنر تھا تو اس کا سالہ تھا۔
1619,کہہ رہا ہے شور دریا سے سمندر کا سکوت
1620,ہمیں ہے خیال اسکا کہ جو آیا خواب میں وہ
1621,بعض پرانے لوگوں کا خیال ہے کہ میری یادیں والا
1622,محبت کے سفر میں ساتھ میرے چل نہیں سکتے
1623,ہو چاہے اک زمانہ کسی رہنما کے ساتھ
1624,سچا سوا ریلوے اسٹیشن پاکستان میں واقع ہے۔
1625,کوشش ترک کرنے سے قبل ضرور غور کیجئے
1626,یہ تلافی حکومت یا بینکار پر عائد ہوتی ہے۔
1627,تو کیا گلہ گر میں بھول جاتا ہوں کہ
1628,تری نسبت کی قسم ہم بھی خوش القاب ہوئے
1629,اس اوور میں بھی ایک اپیل ہوئی لیکن ناٹ
1630,میرے بلاگ پر تشریف لانے کے لئے شکریہ
1631,تیرے پیار میں رسوا ہو کر جائیں کہاں دیوانے لوگ
1632,کرتے ہو داغ دور سے مئے خانے سلام
1633,معرکے کے خاتمے کے بعد گرفتار ہو گئے تھے۔
1634,2 مزاج کے خلاف کسی کو برداشت نہیں کرتی
1635,یجروید سناتن دھرم کا ایک اہم مقدس وید ہے۔
1636,دل نے چاہا بھی اگر ہونٹوں نے جنبش نہیں کی
1637,شہ سفر میں ہیں کہاں کا چاند کیسی چاندنی
1638,عام بات ہے طوطے کا بولنا لیکن وہ بولتا کیا ہے
1639,پتھر کی دیواروں والے کنویں بنائے جاتے تھے۔
1640,نتیجہ : سری لنکا 9 وکٹوں سے فتح یاب
1641,پر جو مجھے پسند ہے گھر سے کم نکلے
1642,آپ بار بار ایک ہی غلطی کیوں دہراتے ہیں
1643,کوائف نامے پر ملک عدنان احمد کے مراسلے پر تبصرے
1644,دل کو مضبوط کیسے کیا جائے کہ وہ نہ ٹوٹے
1645,جہاں نہ بات کوئی اس کی اس کے در کی ہے
1646,شاعری کی طاقت دنیا کو پھر دکھا دیجئے
1647,تو دونوں ہاتھوں سے لیتے ہیں ہم کلیجہ تھام
1648,تین لڑکیوں کے نام جو ن پر ختم ہوتے ہوں
1649,یہ بازار اینٹوں اور چونے سے تعمیر کیا گیا ہے۔
1650,خاک میں گزرا ہوا کل نہیں ڈھونڈا کرتے
1651,آتا ہے بعد ظلم تمہیں کو تو رحم بھی
1652,وہی تو دن تھے مرے کھیلنے کے کھانے کے
1653,سکینہ کے والد گرامی سردار کربلا حسین ہیں۔
1654,کرت پور کی مجموعی آبادی افراد پر مشتمل ہے
1655,تحریر طنزیہ اور بریکٹ ہے یعنی آف دی ریکارڈ
1656,عباسی اس کی داشتہ ہے اور حسنا اس کی محبوبہ ہے۔
1657,دونوں پولیس کے فرق کو 5 مثالوں سے واضح کریں
1658,کو ہندوستان کابینہ میں دیہی آبادی کے وزیر بنے
1659,اس علاقے میں زلزلے بھی آتے رہتے ہیں۔
1660,بہت ہی کمال تصویر پوسٹ کی ہے شکریہ
1661,اس حد تک مجھے غصہ کبھی نہیں آسکتا ہے
1662,لیاری گینگ وار اور کراچی کا امن و امان
1663,ایک کمزور اور بے وقوف ہیرو جیسا کردار ہے۔
1664,ہم ازل سے آزاد ہیں اور آزاد رہیں گے۔
1665,ہم قبر میں ان لوگوں کی امداد کریں گے
1666,بس یونہی اس کے در کا کئے جاتی ہے طواف
1667,آسماں پہ جا بیٹھے یہ خبر نہیں تم کو
1668,دشت طلب سے دور کوئی شہر زر نہ تھا
1669,بس دعا کریں کہ دال صاف ہو جائے
1670,ہمارے جسم کے پانی سے سرد ہو بھی چکی
1671,یہ بندہ بھی آن لائن ہے ویسے تو
1672,جیسے اجرت کو خوردہ قیمت کے اشاریہ سے منسلک کر
1673,ایک لمحے کو مجھے اپنا زمانہ دے دے
1674,میں نے کہا شوق سے ضرور پڑھوا دیجئے۔
1675,اس کی دیگر اشکال بھی ہیں جیسے دو چشمی ہے یا
1676,پاور فیکٹر کا جرمانہ ختم ہو جاتا ہے۔
1677,جی ی پرسو آپ نے بھی ایسا ہی کیا تھا
1678,اس ماہنامے کا مقصد دینی معاملوں پر گفتکو تھا۔
1679,اور اس کو رینگت کی کی طرح کی حیثیت دی گئی۔
1680,بستی فوجا ریلوے اسٹیشن پاکستان میں واقع ہے۔
1681,شام : ایندھن کی قلت سے امدادی سرگرمیاں متاثر
1682,اس نے مر مر کو ہی ہمراز بنانا چاہا
1683,لاکھ مرے ہونٹوں پر چپ کی مہریں ھوں
1684,ذاتی ملکیت بنانے کے بھیس میں نجکاری کا عمل
1685,متبادل بھی تو کوئی میسر نہیں ہے پاکستان والوں کو
1686,ہو سب نغمہ سرا کچھ اس طرف کچھ اس طرف
1687,امید بہنا آپ یوٹیوب سے کچھ بنانا سیکھ لیں ناں
1688,صابر صاحب کا سوال تو خوب تر ہے
1689,کے سروے کے مطابق رومن کیتھولک افراد کی تعداد تھی
1690,دھیرے دھیرے جام ہستی ہو رہا ہے کم مرا
1691,اب پورے محلے میں اعلان نہ کر دینا
1692,یہ بے جہات کا عالم کہاں ہے سب کے لئے
1693,مولوی کی جیب میں ہاتھ پڑ گیا تھا ۔
1694,سگے بھائی کے سینے میں بھی نفرت جاگ جاتی ہے
1695,مجھے اب یہاں اجنبی لگنے لگا ہے آ کے
1696,ہائے لگتا ہے مجھے سب بھول گئے ہیں
1697,بیٹا: جعفر بن علی میدان کربلا میں شہید ہوئے
1698,ایک منٹ ابھی ڈھونڈ کر لاتی ہوں اسکی تصویر
1699,مروان کو ابن زیاد کے مشورہ سے حوصلہ ہوا
1700,اکبر وارثی کی وجہ شہرت میلاد اکبر ہے۔
1701,ہم سایہ دار پیڑ زمانے کے کام آئے
1702,ارادے باندھتا ہوں، سوچتا ہوں توڑ دیتا ہوں
1703,ظاہر ہے یہاں کی عادت جو پڑ جاتی ہے
1704,پاکستان ایشیا کپ فتح اللہ 1 بجے دوپہر
1705,قیصرانی یعنی مجھے شریف برادران بنا رہے ہیں :
1706,جب اک بیٹی بہو بن کر سسرال میں پہنچتی ہے
1707,بیت اللہ محسود کے جاں بحق ہونے کی تصدیق
1708,کاوش نغمہ رنگ اثر سے عاری کی عاری ہی رہی
1709,امریکی ایف سولہ سیڈ مشن سے واپسی پر
1710,سیدنا عمر فاروق رضی اللہ عنہ کا فرمان
1711,دینیات کے موضوع پر نیشنل عربک انسٹیٹیوٹ سے ڈپلوما کیا۔
1712,یہ فلم بین جنسیت کے موضوع پر بنی ہے۔
1713,کچھ مصروفیات کی بنا پر نیٹ کی دنیا سے دور تھا
1714,جب نشاں تک نہ رہا قبر کا میری باقی
1715,یمن : چار ارب ڈالر کی امداد کا اعلان
1716,اس لیے میں آپ کی ک گمشدگی کا اشتہار کیسے دیتا
1717,راحت کی کسی سایہ میں جز سایہ قیصر
1718,جی کی جی میں رہی بات نہ ہونے پائی
1719,اسپیشل ایجوکیشن کمپلیکس فار ڈسایبلڈ خالقآباد، قلات ڈویژن
1720,تیسرا خالص وادی سندھ کے رنگ دھنگ ہیں۔
1721,معاشرے میں خواتین و حضرات کا مساوی مقام
1722,مثلا وہ تین بچوں کا باپ بن گیا۔
1723,کب سے خوابوں کو یہاں بھول گئی تھی بونا
1724,کر لینا جتنا چاہو کرلینا مجھے کوئ اعتراض نہیں
1725,بی مصری صاحبہ کا امام باڑہ اکبر سے کربلا کی
1726,نزدیک اسکے طور کے پتھر میں کچھ نہ تھا
1727,استانی جی میری حاضری لگا دیں آج پھر
1728,کبھی نہ کھیتوں میں پھر خونی کھاد پھلے گی
1729,چوٹی بحر میں عدم صاحب کو کمال حاصل تھا
1730,چلیں یہ بھی پپو بھائی خود آ کر بتائیں ہمیں
1731,گلے جب اس کے ہوں تو آنکھیں بھیگ جاتی ہیں
1732,اردو: پانی کمزور جگہ سے گزر جاتا ہے
1733,شکریہ تو ہم نے بصد شکریہ قبول فرمایا
1734,وہ خدا نہ تھا لیکن کس قدر اکیلا تھا
1735,عجب فرصت کہ عالم وہ ہونٹوں کو سجاتا ہے
1736,صرف اسی ایک بات کو مدنظر رکھا جائے ۔
1737,نہیں باز چیزیں ایک ہی جگہ ٹھیک رہتی ہیں
1738,اب اجازت دیجئے ہم نے کہیں جانا بھی ہے
1739,1 امام اعظم ابو حنیفہ رضی اللہ عنہ
1740,ہما رے سر کی پھٹی ٹوپیوں پہ طنز نہ کر
1741,امام باڑہ شاہ نجف بن ابی طالب سے
1742,تیری کشت فکر سے اگتے ہیں عالم سبزہ وار
1743,قیصرانی بھی نہیں کہ کوئی چکن مصالحہ ہی بنا دیتا
1744,انھیں 1920 میں کیمسٹری دا نوبیل انعام دیا گیا۔
1745,عذاب میں بھی یہ ہم پر کمال ہوتا رہا
1746,خرم شہزاد خرم ، جولائی 20 ، 2012
1747,خرم شہزاد خرم ، جنوری 8 ، 2013
1748,صحرائےکالاہاری کا شمار دنیا کے عظیم میں کیا جاتا ہے۔
1749,لکھے پڑھے ہوتے اگر تو ہم بھی حصہ لیتے
1750,ان کا تعلق پاکستان کے بلوچ قبیلے کھوسہ سے ہے۔
1751,مری نظر کے سامنے گنبد ہو وہ ہرا فقط
1752,"""3 تبصرے برائے تحریر """" انضمام الحق پاکستان """""""
1753,25 ۔ صدر اسلام کی شاعری کا کیا حال تھا
1754,کسی کو خوش کرنا بھی اچھی بات ہے نا
1755,مولانا قاسمی ہمارے درمیان نہیں رہے قومی آواز
1756,فرقہ امامیہ عشریہ کی علم احادیث میں چاروں کتابیں
1757,جوش شاعروں کا منشور - جوش ملیح آبادی
1758,اونچے درجے میں سرکٹس اور صوبے آتے ہیں۔
1759,حیاتیات میں نسب کے مطالعے کو وراثیات کہتے ہیں۔
1760,اس نے یہ بھی لکھا ہے میرے گھر نہیں آنا
1761,اے کاش پڑے ان سے کبھی آپ کو پالا
1762,اسی لئے محنتی ہوتے ہیں بہت محنتی تھا میرا بیٹا
1763,دونوں نے جلسے میں شرکت کی زحمت نہیں کی۔
1764,ہم تو چلے پر دیس ہم پردیسی ہو گے ۔
1765,اصلاح و درستگی کی غرض سے حاضر کیے ہیں
1766,پابندی ہونے نہ ہونے سے فرق نہیں پڑتا ۔
1767,احمد شہزاد کا اچھا ڈرائیو چار رنز کے لیے
1768,1981ء میں سپریم کورٹ کے ایڈہاک جج رہے ۔
1769,اتنی مشکل اردو اور بات بھی سمجھ نہیں آئی
1770,ازل میں روح کو عشق نبی عطا کرنا
1771,اور دوسرا ثبوت مدعی پر ہوتا ہے مدعی آپ ہیں
1772,لو جی یہ دن بھی دیکھ لیا ہم نے
1773,کیا کہنے ہمارے ملک کے کالم نگاروں کی منطق کے
1774,یوں ہوا منصور کمرہ بھر گیا کرنوں کے ساتھ
1775,ہر دشمن کے مقابلے کے لیئے ایک دوست ہوتا ہے
1776,جیسے اس وقت آپ ندارد ہیں کیا خبر مخفی ہوں
1777,میں نے بھی نوجوانی کے کچھ دن جرمنی میں گذارے ہیں
1778,جمشید نے درجنوں ٹیوی ڈراموں میں کام کیا۔
1779,خدا کسی سے کسی کو مگر جدا نہ کرئے
1780,البتہ مقصد اصل کہانی والا ہی رکھا ہے
1781,عروج امان اللہ اور سارہ انصاری تیسری پوزیشن
1782,بتائے کون کہ کاغذ کی سطح خالی پر
1783,نگہ میری اٹھے جس سمت دنیا ہی بدل جائے
1784,نصاب التجوید : مولانا محمد ہاشم خان صفحہ کراچی
1785,جو تم گئی تو یہ جانا میری شریک حیات
1786,گرفتاری پہ میری بس کہ آہن گریہ کرتا ہے
1787,صوبہ بلوچستان ضلع کے شمال میں واقع ہے۔
1788,تیلگو دیشم پارٹی کی جانب سے دو مرتبہ یم۔
1789,شاکر بھائی ایم فل کر رہے ہیں بھیا
1790,جبکہ ان کے 6 لاکھ سے زائد زخمی ہوئے۔
1791,سعید اجمل کا دوسرا اوور اور دوسری وکٹ
1792,میڈا دھرم وی توں میڈا بھرم وی توں
1793,اشعار جن میں رخ یار کا ذکر ہو
1794,آ جا دونوں ہاتھ پکڑ کر چلتے ہیں
1795,آداب عرض ہے یہ شعر اسی خادم کا ہے
1796,اور نہ ہی نثری نظم کو شاعری مانا جاتا ہے
1797,جب کہ ہر ناز ترا حوصلہ فرسا ہو گا
1798,اس کی سرحدوں کا تعین میں کیا جا چکا تھا
1799,میٹرک تک غریب خاندانوں کی لڑکیوں کو مفت تعلیم
1800,مقامی نام فائے چان کنگری یا پھلچن کنگری ہے۔
1801,یہاں بہت سے تھے میر و غالب کی چاہ والے
1802,آپ کے والد کا نام ملک مکھنہ خان تھا۔
1803,مزاج شاہ ہو یوں منحرف تو مجھ کو بھی
1804,نیپچون کا اوسط درجہحرارت منفی 200 ڈگری سینٹیگریڈ ہے۔
1805,جنگل سے آئی اتنے میں اکبر کی یہ صدا
1806,پانی پانی کر گئی مجھ کو قلندر کی یہ بات
1807,لیکن تفسیر بھائی نے تو خود اعتراف کیا ہے کہ
1808,یہ انڈونیشیا کے جیونیز نسل سے تعلق رکھتے ہیں۔
1809,وہی تو ہے جسے پچھلی صدی نے قتل کیا
1810,تعلیم فقط وضع بدل دیتی تو کیا غم
1811,سحر طاری ہوئی ہے آپ کے ماتھے کی طلعت سے
1812,مقتدرہ کا پرانا کی بورڈ ونڈوز کے لیے درکار ہے
1813,امن ایمان مجھے نہیں لگتا اس دھاگے پر آئیں
1814,انکل ٹام یار کچھ کرو آج پھر میچ ہے
1815,فتاوی رضویہ احمد رضا خان بریلوی جلد 29 صفحہ
1816,ایک لاکھ روپیوں کا صدقہ حکیم صاحب گرتے گرتے بچے
1817,پھر تو آرام کر کر کے آپ نے موٹے ہوجانا ہے
1818,یہ مینار بورستول، بکنگھمشائر، انگلستان میں موجود ہے۔
1819,اتنا معصوم سا تو ہے میرا اوتار میری طرح
1820,تب ہی اوتار میں منہ ایسے بنا لیا ہے
1821,سینہ محبت کرنے والوں کی پہلے قبریں تیار کرتا ہے
1822,سرائے عالمگیر ضلع گجرات پاکستان کا ایک شہر اور تحصیل ہے
1823,اللہ آپ کے بھائی کو بالکل ٹھیک کر دیں گے
1824,حسن سے چوک ہوئی اس کی ہے تاریخ گواہ
1825,تو نمک پانے کیسے رہیں گے اپ کے لیے
1826,جس سے بیرون ملک بھی لوگ آپ کے متعرف ہیں۔
1827,خوشی ہے آمنہ کے گھر وہ آئے نور کے پیکر
1828,میں چلا کہ مزید کچھ کتب پڑھ لوں
1829,خاطر سے یا لحاظ سے میں مان تو گیا
1830,اتر گیا تن نازک سے پتیوں کا لباس
1831,جو کچھ بھی سوچا جائے بیان کرنا چاہےے۔
1832,اچھا مجھے تو کافی مہنگا لگ رہا ہے
1833,حر بن یزید تمیمی واقعہ کربلا کی ایک اہم شخصیت
1834,23اکتوبر 1295ء کو فرانس اور اسکاٹلینڈ کے درمیان ہو گیا۔
1835,اللہ سب پر پنا رحم نازل فرمائے آمین
1836,گلشن جیسے آنگن میں ہم آنکھ مچولی کھیلے تھے
1837,حضرت زینب رضی اللہ تعالی عنہا بنت ابی معاویہ
1838,یہ گیزہ کے تین اہراموں میں سب سے چھوٹا ہے۔
1839,بس ازان کا انتظار ہے اور میں چلی سونے
1840,قاتل نے لگایا نہ مرے زخم پر مرہم
1841,سن کہ اب مخلوق تجھ سے خوش نہیں
1842,ہسپتال سے چھوٹی طبی سہولت کو مطب ہے۔
1843,اردو غزل کے اظہار کے موضوعات کا تعین کیا۔
1844,ووٹ ڈالے سے تو آجاتی تھی منہ پر رونق
1845,اور اس وقت تک پاکستان ویں درجہ پر فائز ہے
1846,جہاں جہاں اس بزم میں کوئی بھی تصویر ہے
1847,عوامی حلقوں میں عدالتی فیصلہ کو سراہا گیا
1848,پاکستان کے چین کے ساتھ تعلقات انتہائی اچھے ہیں۔
1849,بالکل صحیح پپو جی کی اچھی طرح خبر لیں
1850,آخر کو علامہ اقبال نے غلط نہیں فرمایا تھا
1851,ابھی ویسٹ انڈیز کی بیٹنگ دیکھنے کے منتظر ہیں
1852,ہماری بہت سی مشکلات کا آسان سا حل
1853,خوف اچھا ہے کہ بچوں کی ہنسی اچھی ہے
1854,یہ اگر صرف تصور ہے مرا تو اے کاش
1855,جنرل سہارتو نے انڈویشیا پر تین دہائیوں تک حکومت کی۔
1856,الشامیہ میں عراق کے صوبہ قادسیہ کا ایک شہر ہے۔
1857,بس کردیں غلطی پر غلطی کر رہیں ہیں آپ
1858,ان لوگوں کی زراعت خاصی ترقی یافتہ تھی۔
1859,روح گلشن، مرے آقا کا پسینہ ہے عدیم
1860,ان پرندوں کو قفس میں بھی ہے راحت کا خیال
1861,سب ہی حاکم ہیں مگر کوئی حکومت بھی نہیں
1862,یہاں تک کہ وہ اپنی بات پوری کر لیتا ۔
1863,کھچی والا ریلوے اسٹیشن پاکستان میں واقع ہے۔
1864,بدنہ: اونٹ یا گائے اور بیل بھی شامل
1865,اس وعدہ خلافی نے اگر جان ہی لے لی
1866,میر شاہ نواز خان خان آف قلات کے بھائی
